ts_code,symbol,name,enname,aliases
A32.VN,A32.VN,Công ty Cổ phần 32,Công ty 32,
AAA.VN,AAA.VN,Công ty Cổ phần Nhựa An Phát Xanh,An Phát Bioplastics,
AAH.VN,AAH.VN,Công ty Cổ phần Hợp Nhất,Than Hợp Nhất,
AAM.VN,AAM.VN,Công ty Cổ Phần Thủy Sản MeKong,Thủy sản Mekong,
AAN.VN,AAN.VN,Công ty Cổ phần Lương thực A An,Công ty Cổ phần Lương thực A An,
AAS.VN,AAS.VN,Công ty Cổ phần Chứng khoán SmartInvest,Chứng khoán SmartInvest,
AAT.VN,AAT.VN,Công ty Cổ phần Tập đoàn Tiên Sơn Thanh Hóa,Tập đoàn Tiên Sơn Thanh Hóa,
AAV.VN,AAV.VN,Công ty Cổ phần AAV Group,Việt Tiên Sơn Địa ốc,
ABB.VN,ABB.VN,Ngân hàng Thương mại Cổ phần An Bình,Ngân hàng An Bình,
ABC.VN,ABC.VN,Công ty Cổ phần Truyền thông VMG,Truyền thông VMG,
ABI.VN,ABI.VN,Công ty Cổ phần Bảo hiểm Ngân hàng Nông Nghiệp,BH NH Nông Nghiệp,
ABR.VN,ABR.VN,Công ty Cổ phần Đầu tư Nhãn Hiệu Việt,Đầu tư Nhãn Hiệu Việt,
ABS.VN,ABS.VN,Công ty Cổ phần Dịch vụ Nông nghiệp Bình Thuận,DV Nông nghiệp Bình Thuận,
ABT.VN,ABT.VN,Công ty Cổ phần Xuất nhập khẩu Thủy sản Bến Tre,Thủy sản Bến Tre,
ABW.VN,ABW.VN,Công ty Cổ phần Chứng khoán An Bình,Chứng khoán An Bình,
ACB.VN,ACB.VN,Ngân hàng Thương mại Cổ phần Á Châu,ACB,ACB Bank
ACC.VN,ACC.VN,Công ty Cổ phần Đầu tư và Xây dựng Bình Dương ACC,Đầu tư và XD Bình Dương ACC,
ACE.VN,ACE.VN,Công ty Cổ phần Bê tông ly tâm An Giang,Bê tông An Giang,
ACG.VN,ACG.VN,Công ty Cổ phần Gỗ An Cường,Gỗ An Cường,
ACL.VN,ACL.VN,Công ty Cổ phần Xuất nhập khẩu Thủy sản Cửu Long An Giang,Thủy sản CL An Giang,
ACM.VN,ACM.VN,Công ty Cổ phần Tập đoàn Khoáng sản Á Cường,Tập đoàn Khoáng sản Á Cường,
ACS.VN,ACS.VN,Công ty Cổ phần Xây lắp Thương mại 2,Xây lắp Thương mại 2,
ACV.VN,ACV.VN,Tổng Công ty Cảng Hàng không Việt Nam - CTCP,Cảng Hàng không VN,
ADC.VN,ADC.VN,Công ty Cổ phần Mĩ thuật và Truyền thông,Mĩ thuật và Truyền thông,
ADG.VN,ADG.VN,Công ty Cổ phần Clever Group,Clever Group,
ADP.VN,ADP.VN,Công ty Cổ phần Sơn Á Đông,Sơn Á Đông,
ADS.VN,ADS.VN,Công ty Cổ phần DAMSAN,Dệt sợi DAMSAN,
AFX.VN,AFX.VN,Công ty Cổ phần Xuất Nhập khẩu Nông sản Thực phẩm An Giang,XNK Nông sản Thực phẩm An Giang,
AG1.VN,AG1.VN,Công ty Cổ phần 28.1,28.1 JSC,
AGF.VN,AGF.VN,Công ty Cổ phần Xuất nhập khẩu Thủy sản An Giang,Thủy sản An Giang,
AGG.VN,AGG.VN,Công ty Cổ phần Đầu tư và Phát triển Bất động sản An Gia,Bất động sản An Gia,
AGM.VN,AGM.VN,Công ty Cổ phần Xuất nhập khẩu An Giang,XNK An Giang,
AGP.VN,AGP.VN,Công ty Cổ phần Dược phẩm AGIMEXPHARM,Dược phẩm AGIMEXPHARM,
AGR.VN,AGR.VN,Công ty Cổ phần Chứng khoán AGRIBANK,Agriseco,
AGX.VN,AGX.VN,Công ty Cổ phần Thực phẩm Nông sản Xuất khẩu Sài Gòn,Nông sản Xuất khẩu Sài Gòn,
AIC.VN,AIC.VN,Công ty Cổ phần Tập đoàn Bảo hiểm DBV,Bảo hiểm DBV,
AIG.VN,AIG.VN,Công ty Cổ phần Nguyên liệu Á Châu AIG,Nguyên liệu Á Châu AIG,
ALC.VN,ALC.VN,Công ty Cổ phần Âu Lạc,Công ty Âu Lạc,
ALT.VN,ALT.VN,Công ty Cổ phần Văn hóa Tân Bình,Văn hóa Tân Bình,
ALV.VN,ALV.VN,Công ty Cổ phần Tập đoàn MCST,Tập đoàn MCST,
AMC.VN,AMC.VN,Công ty Cổ phần Khoáng sản Á Châu,Khoáng sản Á Châu,
AME.VN,AME.VN,Công ty cổ phần Alphanam E&C,Cơ điện Alphanam,
AMP.VN,AMP.VN,Công ty Cổ phần Armephaco,Armephaco,
AMS.VN,AMS.VN,Công ty Cổ phần Cơ khí Xây dựng AMECC,Xây dựng AMECC,
AMV.VN,AMV.VN,Công ty Cổ phần Sản xuất Kinh doanh Dược và Trang thiết bị Y tế Việt Mỹ,Dược-TB Y tế Việt Mỹ,
ANT.VN,ANT.VN,Công ty Cổ phần Rau quả Thực phẩm An Giang,Rau quả thực phẩm An Giang,
ANV.VN,ANV.VN,Công ty Cổ phần Nam Việt,Thủy sản Nam Việt,
APC.VN,APC.VN,Công ty Cổ phần Chiếu xạ An Phú,Chiếu xạ An Phú,
APF.VN,APF.VN,Công ty Cổ phần Nông sản Thực phẩm Quảng Ngãi,Nông sản Quảng Ngãi,
APG.VN,APG.VN,Công ty Cổ phần Chứng khoán APG,Chứng khoán APG,
APH.VN,APH.VN,Công ty Cổ phần Tập đoàn An Phát Holdings,Tập đoàn An Phát Holdings,
API.VN,API.VN,Công ty Cổ phần Đầu tư Châu Á - Thái Bình Dương,Đầu tư Châu Á - Thái Bình Dương,
APL.VN,APL.VN,Công ty Cổ phần Cơ khí và Thiết bị áp lực - VVMI,Cơ khí và Thiết bị áp lực - VVMI,
APP.VN,APP.VN,Công ty Cổ phần Phát triển Phụ gia và Sản phẩm dầu mỏ,Phụ gia và SP Dầu mỏ,
APS.VN,APS.VN,Công ty Cổ phần Chứng khoán Châu Á - Thái Bình Dương,CK Châu Á - TBD,
APT.VN,APT.VN,Công ty Cổ phần Kinh doanh thủy hải sản Sài Gòn,Thủy hải sản Sài Gòn,
ARM.VN,ARM.VN,Công ty Cổ phần Xuất nhập khẩu Hàng không,XNK Hàng không,
ART.VN,ART.VN,Công ty Cổ phần Chứng khoán ARTEX,Chứng khoán ARTEX,
ASG.VN,ASG.VN,Công ty Cổ phần Tập đoàn ASG,Tập đoàn ASG,
ASM.VN,ASM.VN,Công ty Cổ phần Tập đoàn Sao Mai,Tập đoàn Sao Mai,
ASP.VN,ASP.VN,Công ty Cổ phần Tập đoàn Dầu khí An Pha,Dầu khí An Pha,
AST.VN,AST.VN,Công ty Cổ phần Dịch vụ Hàng không Taseco,Dịch vụ Hàng không Taseco,
ATA.VN,ATA.VN,Công ty Cổ phần NTACO,NTACO,
ATG.VN,ATG.VN,Công ty Cổ phần ATG Planet,ATG Planet,
ATS.VN,ATS.VN,Công ty Cổ phần Tập đoàn Đầu tư ATS,Tập đoàn Đầu tư ATS,
AVC.VN,AVC.VN,Công ty Cổ phần Thủy điện A Vương,Thủy điện A Vương,
AVG.VN,AVG.VN,Công ty Cổ phần Phân Bón Quốc Tế Âu Việt,Phân Bón Quốc Tế Âu Việt,
BAB.VN,BAB.VN,Ngân hàng Thương mại Cổ phần Bắc Á,Ngân hàng Bắc Á,
BAF.VN,BAF.VN,Công ty Cổ phần Nông nghiệp BAF Việt Nam,Nông nghiệp BAF Việt Nam,
BAL.VN,BAL.VN,Công ty Cổ phần Bao bì Bia - Rượu - Nước giải khát,Bao bì Balpac,
BAX.VN,BAX.VN,Công ty Cổ phần Thống Nhất,Công ty Thống Nhất,
BBH.VN,BBH.VN,Công ty Cổ phần Bao bì Hoàng Thạch,Bao bì Hoàng Thạch,
BBM.VN,BBM.VN,Công ty Cổ phần Bia Hà Nội - Nam Định,Bia Hà Nội - Nam Định,
BBS.VN,BBS.VN,Công ty Cổ phần VICEM Bao bì Bút Sơn,Bao bì Xi măng Bút Sơn,
BBT.VN,BBT.VN,Công ty Cổ phần Bông Bạch Tuyết,Bông Bạch Tuyết,
BCA.VN,BCA.VN,Công ty cổ phần B.C.H,Công ty B.C.H,
BCB.VN,BCB.VN,Công ty Cổ phần 397,Công ty 397,
BCC.VN,BCC.VN,Công ty Cổ phần Xi măng Bỉm Sơn,Xi măng Bỉm Sơn,
BCE.VN,BCE.VN,Công ty Cổ phần Xây dựng và Giao thông Bình Dương,XD và GT Bình Dương,
BCF.VN,BCF.VN,Công ty Cổ phần Thực phẩm Bích Chi,Thực phẩm Bích Chi,
BCG.VN,BCG.VN,Công ty Cổ phần Tập đoàn Bamboo Capital,Bamboo Capital,
BCM.VN,BCM.VN,Tập đoàn Đầu tư và Phát triển Công nghiệp Becamex - CTCP,Becamex Group,Becamex
BCP.VN,BCP.VN,Công ty Cổ phần Dược Enlie,Dược Enlie,
BCR.VN,BCR.VN,Công ty Cổ phần BCG Land,BCG Land,
BCV.VN,BCV.VN,Công ty Cổ phần Du lịch và Thương mại Bằng Giang Cao Bằng - Vimico,DL và TM Bằng Giang Cao Bằng - Vimico,
BDG.VN,BDG.VN,Công ty Cổ phần May mặc Bình Dương,May mặc Bình Dương,
BDT.VN,BDT.VN,Công ty Cổ phần Xây lắp và Vật liệu xây dựng Đồng Tháp,VLXD Đồng Tháp,
BDW.VN,BDW.VN,Công ty Cổ phần Cấp thoát nước Bình Định,Cấp thoát nước Bình Định,
BED.VN,BED.VN,Công ty Cổ phần Sách và Thiết bị trường học Đà Nẵng,Sách Đà Nẵng,
BEL.VN,BEL.VN,Công ty Cổ phần Điện tử Biên Hòa,Điện tử Biên Hoà,
BFC.VN,BFC.VN,Công ty Cổ phần Phân bón Bình Điền,Phân bón Bình Điền,
BGE.VN,BGE.VN,Công ty Cổ phần BCG Energy,BCG Energy,
BGW.VN,BGW.VN,Công ty Cổ phần Nước sạch Bắc Giang,Nước sạch Bắc Giang,
BHA.VN,BHA.VN,Công ty Cổ phần Thủy điện Bắc Hà,Thủy điện Bắc Hà,
BHC.VN,BHC.VN,Công ty Cổ phần Bê tông Biên Hòa,Bê tông Biên Hòa,
BHG.VN,BHG.VN,Công ty Cổ phần Chè Biển Hồ,Chè Biển Hồ,
BHH.VN,BHH.VN,Công ty Cổ Phần Bia Hà Nội - Hưng Yên 89,Habeco Trading 89,
BHI.VN,BHI.VN,Tổng Công ty Cổ phần Bảo hiểm Sài Gòn - Hà Nội,Bảo hiểm Sài Gòn - Hà Nội,
BHK.VN,BHK.VN,Công ty Cổ phần Bia Hà Nội - Kim Bài,Bia Hà Nội - Kim Bài,
BHN.VN,BHN.VN,Tổng Công ty Cổ phần Bia - Rượu - Nước giải khát Hà Nội,HABECO,
BHP.VN,BHP.VN,Công ty Cổ phần Bia Hà Nội - Hải Phòng,Bia Hà Nội - Hải Phòng,
BIC.VN,BIC.VN,Tổng Công ty Cổ phần Bảo hiểm Ngân hàng Đầu tư và Phát triển Việt Nam,Bảo hiểm BIDV,
BID.VN,BID.VN,Ngân hàng Thương mại Cổ phần Đầu tư và Phát triển Việt Nam,BIDV,BIDV
BIG.VN,BIG.VN,Công ty Cổ phần Đầu tư BIG Group Holdings,BIG Group Holdings,
BIO.VN,BIO.VN,Công ty Cổ phần Vắc xin và Sinh phẩm Nha Trang,Vắc xin và Sinh phẩm Nha Trang,
BKC.VN,BKC.VN,Công ty Cổ phần Khoáng sản Bắc Kạn,Khoáng sản Bắc Kạn,
BKG.VN,BKG.VN,Công ty Cổ phần Đầu tư BKG Việt Nam,Đầu tư BKG Việt Nam,
BLF.VN,BLF.VN,Công ty Cổ phần Thủy sản Bạc Liêu,Thủy sản Bạc Liêu,
BLI.VN,BLI.VN,Tổng Công ty Cổ phần Bảo hiểm Bảo Long,Bảo hiểm Bảo Long,
BLN.VN,BLN.VN,Công ty Cổ phần Vận tải và Dịch vụ Liên Ninh,Xe buýt Liên Ninh,
BLT.VN,BLT.VN,Công ty Cổ phần Lương thực Bình Định,Lương Thực Bình Định,
BMC.VN,BMC.VN,Công ty Cổ phần Khoáng sản Bình Định,Khoáng sản Bình Định,
BMD.VN,BMD.VN,Công ty Cổ phần Môi trường và Dịch vụ Đô thị Bình Thuận,Môi trường và DV Đô thị Bình Thuận,
BMF.VN,BMF.VN,Công ty Cổ phần Vật liệu Xây dựng và Chất đốt Đồng Nai,VLXD và Chất đốt Đồng Nai,
BMG.VN,BMG.VN,Công ty Cổ phần May Bình Minh,May Bình Minh,
BMI.VN,BMI.VN,Tổng Công ty Cổ phần Bảo Minh,Bảo hiểm Bảo Minh,
BMJ.VN,BMJ.VN,Công ty Cổ phần Khoáng sản Miền Đông AHP,Khoáng sản Miền Đông AHP,
BMK.VN,BMK.VN,Công ty Cổ Phần Kỹ thuật Nhiệt Mèo Đen,Black Cat,
BMP.VN,BMP.VN,Công ty Cổ phần Nhựa Bình Minh,Nhựa Bình Minh,
BMS.VN,BMS.VN,Công ty Cổ phần Chứng khoán Bảo Minh,Chứng khoán Bảo Minh,
BMV.VN,BMV.VN,Công ty Cổ phần Bột mỳ Vinafood 1,Bột mỳ Vinafood 1,
BNA.VN,BNA.VN,Công ty Cổ phần Tập đoàn Đầu tư Bảo Ngọc,Tập đoàn Đầu tư Bảo Ngọc,
BNW.VN,BNW.VN,Công ty Cổ phần Nước sạch Bắc Ninh,Nước sạch Bắc Ninh,
BOT.VN,BOT.VN,Công ty Cổ phần BOT Cầu Thái Hà,BOT Cầu Thái Hà,
BPC.VN,BPC.VN,Công ty Cổ phần Vicem Bao bì Bỉm Sơn,Bao bì Bỉm Sơn,
BQB.VN,BQB.VN,Công ty Cổ phần Bia Hà Nội - Quảng Bình,Bia Hà Nội - Quảng Bình,
BQP.VN,BQP.VN,Công ty Cổ phần Nhựa chất lượng cao Bình Thuận,Nhựa Chất Lượng Cao Bình Thuận,
BRC.VN,BRC.VN,Công ty Cổ phần Cao su Bến Thành,Cao su Bến Thành,
BRR.VN,BRR.VN,Công ty Cổ phần Cao su Bà Rịa,Cao su Bà Rịa,
BRS.VN,BRS.VN,Công ty Cổ phần Dịch vụ Đô thị Bà Rịa,Dịch vụ Đô thị Bà Rịa,
BSA.VN,BSA.VN,Công ty Cổ phần Thủy điện Buôn Đôn,Thủy điện Buôn Đôn,
BSD.VN,BSD.VN,"Công ty Cổ phần Bia, Rượu Sài Gòn - Đồng Xuân","Bia, rượu Sài Gòn - Đồng Xuân",
BSG.VN,BSG.VN,Công ty Cổ phần Xe khách Sài Gòn,Xe khách Sài Gòn,
BSH.VN,BSH.VN,Công ty Cổ phần Bia Sài Gòn - Hà Nội,Bia Sài Gòn - Hà Nội,
BSI.VN,BSI.VN,Công ty Cổ phần Chứng khoán BIDV,Chứng khoán BIDV,
BSL.VN,BSL.VN,Công ty Cổ phần Bia Sài Gòn - Sông Lam,Bia Sài Gòn - Sông Lam,
BSP.VN,BSP.VN,Công ty Cổ phần Bia Sài Gòn - Phú Thọ,Bia Sài Gòn - Phú Thọ,
BSQ.VN,BSQ.VN,Công ty Cổ phần Bia Sài Gòn - Quảng Ngãi,Bia Sài Gòn - Quảng Ngãi,
BSR.VN,BSR.VN,Công ty Cổ phần Lọc Hóa dầu Bình Sơn,Lọc Hóa dầu Bình Sơn,
BT1.VN,BT1.VN,Công ty Cổ phần Bảo vệ thực vật 1 Trung ương,Bảo vệ thực vật 1 TW,
BT6.VN,BT6.VN,Công ty Cổ phần BETON 6,Bê tông 6,
BTB.VN,BTB.VN,Công ty Cổ phần Bia Hà Nội - Thái Bình,Bia Hà Nội - Thái Bình,
BTD.VN,BTD.VN,Công ty Cổ phần Bê tông ly tâm Thủ Đức,Bê tông ly tâm Thủ Đức,
BTG.VN,BTG.VN,Công ty Cổ phần Bao bì Tiền Giang,Bao bì Tiền Giang,
BTH.VN,BTH.VN,Công ty Cổ phần Chế tạo Biến thế và Vật liệu Điện Hà Nội,Biến thế và Vật liệu Điện Hà Nội,
BTN.VN,BTN.VN,Công ty Cổ phần Đầu tư Bitco Bình Định,Gạch Tuy Nen Bình Định,
BTP.VN,BTP.VN,Công ty Cổ phần Nhiệt điện Bà Rịa,Nhiệt điện Bà Rịa,
BTS.VN,BTS.VN,Công ty Cổ phần Xi măng VICEM Bút Sơn,Xi măng Bút Sơn,
BTT.VN,BTT.VN,Công ty Cổ phần Thương mại - Dịch vụ Bến Thành,TM - DV Bến Thành,
BTU.VN,BTU.VN,Công ty Cổ phần Công trình Đô thị Bến Tre,Công trình Đô thị Bến Tre,
BTV.VN,BTV.VN,Công ty Cổ phần Dịch vụ Du lịch Bến Thành,DV Du lịch Bến Thành,
BTW.VN,BTW.VN,Công ty Cổ phần Cấp nước Bến Thành,Cấp nước Bến Thành,
BVB.VN,BVB.VN,Ngân hàng Thương mại Cổ phần Bản Việt,Ngân hàng Bản Việt - BVBank,
BVG.VN,BVG.VN,Công ty Cổ phần Group Bắc Việt,Group Bắc Việt,
BVH.VN,BVH.VN,Tập đoàn Bảo Việt,Tập đoàn Bảo Việt,
BVL.VN,BVL.VN,Công ty Cổ phần BV Land,BV Land,
BVN.VN,BVN.VN,Công ty Cổ phần Bông Việt Nam,Bông Việt Nam,
BVS.VN,BVS.VN,Công ty Cổ phần Chứng khoán Bảo Việt,Chứng khoán Bảo Việt,
BWA.VN,BWA.VN,Công ty Cổ phần Cấp thoát nước và Xây dựng Bảo Lộc,Cấp thoát nước và Xây dựng Bảo Lộc,
BWE.VN,BWE.VN,Công ty Cổ phần - Tổng công ty Nước - Môi trường Bình Dương,Nước - Môi trường Bình Dương,
BWS.VN,BWS.VN,Công ty Cổ phần Cấp Nước Bà Rịa - Vũng Tàu,Cấp Nước Bà Rịa Vũng Tàu,
BXH.VN,BXH.VN,Công ty Cổ phần VICEM Bao bì Hải Phòng,Bao bì Xi măng HP,
C21.VN,C21.VN,Công ty Cổ phần Thế kỷ 21,Thế kỷ 21,
C22.VN,C22.VN,Công ty Cổ phần 22,Công ty 22,
C32.VN,C32.VN,Công ty Cổ phần Đầu tư và Xây dựng 3-2,Đầu tư và Xây dựng 3-2,
C47.VN,C47.VN,Công ty Cổ phần Xây dựng 47,Xây dựng 47,
C4G.VN,C4G.VN,Công ty Cổ phần Tập Đoàn Cienco4,Tập Đoàn Cienco4,
C69.VN,C69.VN,Công ty Cổ phần Xây dựng 1369,Xây dựng 1369,
C92.VN,C92.VN,Công ty Cổ phần Xây dựng và Đầu tư 492,Xây dựng và Đầu tư 492,
CAD.VN,CAD.VN,Công ty Cổ phần Chế biến và Xuất khẩu Thủy sản Cadovimex,Thủy sản Cadovimex,
CAG.VN,CAG.VN,Công ty Cổ phần Cảng An Giang,Cảng An Giang,
CAN.VN,CAN.VN,Công ty Cổ phần Đồ hộp Hạ Long,Đồ hộp Hạ Long,
CAP.VN,CAP.VN,Công ty Cổ phần Lâm Nông sản Thực phẩm Yên Bái,Lâm nông sản Yên Bái,
CAR.VN,CAR.VN,Công ty cổ phần Tập đoàn Giáo dục Trí Việt,Tập đoàn Giáo dục Trí Việt,
CAT.VN,CAT.VN,Công ty Cổ phần Thủy sản Cà Mau,Thủy sản Cà Mau,
CBI.VN,CBI.VN,Công ty Cổ phần Gang thép Cao Bằng,Gang thép Cao Bằng,
CBS.VN,CBS.VN,Công ty Cổ phần Mía đường Cao Bằng,Mía đường Cao Bằng,
CC1.VN,CC1.VN,Tổng Công ty Xây dựng số 1 - CTCP,TCT Xây dựng số 1,
CCA.VN,CCA.VN,Công ty Cổ phần Xuất nhập khẩu Thủy sản Cần Thơ,XNK Thuỷ sản Cần Thơ,
CCC.VN,CCC.VN,Công ty Cổ Phần Xây Dựng CDC,Xây Dựng CDC,
CCI.VN,CCI.VN,Công ty Cổ phần Đầu tư Phát triển Công nghiệp Thương mại Củ Chi,CIDICO,
CCL.VN,CCL.VN,Công ty Cổ phần Đầu tư và Phát triển Đô thị Dầu khí Cửu Long,ĐT & PT Đô thị Dầu khí Cửu Long,
CCM.VN,CCM.VN,Công ty Cổ phần Khoáng sản và Xi măng Cần Thơ,Xi măng Cần Thơ,
CCP.VN,CCP.VN,Công ty Cổ phần Cảng Cửa Cấm Hải Phòng,Cảng Cửa Cấm,
CCR.VN,CCR.VN,Công ty Cổ phần Cảng Cam Ranh,Cảng Cam Ranh,
CCS.VN,CCS.VN,Công ty Cổ phần Chíp Sáng,Chíp Sáng,
CCT.VN,CCT.VN,Công ty Cổ phần Cảng Cần Thơ,Cảng Cần Thơ,
CCV.VN,CCV.VN,Công ty Cổ phần Tư vấn Xây dựng Công nghiệp và Đô thị Việt Nam,XD CN và đô thị Việt Nam,
CDC.VN,CDC.VN,Công ty Cổ phần Chương Dương,Chương Dương Corp,
CDG.VN,CDG.VN,Công ty Cổ phần Cầu Đuống,VLXD Cầu Đuống,
CDN.VN,CDN.VN,Công ty Cổ phần Cảng Đà Nẵng,Cảng Đà Nẵng,
CDO.VN,CDO.VN,Công ty Cổ phần Tư vấn Thiết kế và Phát triển Đô thị,Tư vấn Thiết kế và PT Đô thị,
CDP.VN,CDP.VN,Công ty Cổ phần Dược phẩm Trung ương Codupha,Dược phẩm TW Codupha,
CDR.VN,CDR.VN,Công ty Cổ phần Xây dựng Cao su Đồng Nai,Xây dựng Cao su Đồng Nai,
CEN.VN,CEN.VN,Công ty Cổ phần CENCON Việt Nam,CENCON Việt Nam,
CEO.VN,CEO.VN,Công ty Cổ phần Tập đoàn C.E.O,Tập đoàn CEO,
CET.VN,CET.VN,Công ty Cổ phần HTC Holding,HTC Holding,
CFM.VN,CFM.VN,Công ty Cổ phần Đầu tư CFM,Đầu tư CFM,
CFV.VN,CFV.VN,Công ty Cổ phần Cà phê Thắng Lợi,Cà phê Thắng Lợi,
CGV.VN,CGV.VN,Công ty Cổ phần Vinaceglass,Vinaceglass JSC,
CH5.VN,CH5.VN,Công ty Cổ phần Xây dựng số 5 Hà Nội,Xây dựng số 5 Hà Nội,
CHC.VN,CHC.VN,Công ty Cổ phần Cẩm Hà,Nội thất Cẩm Hà,
CHP.VN,CHP.VN,Công ty Cổ phần Thủy điện Miền Trung,Thủy điện Miền Trung,
CHS.VN,CHS.VN,Công ty Cổ phần Chiếu sáng Công cộng Thành phố Hồ Chí Minh,Chiếu sáng TPHCM,
CI5.VN,CI5.VN,Công ty Cổ phần Đầu tư Xây dựng số 5,Đầu tư Xây dựng số 5,
CIA.VN,CIA.VN,Công ty Cổ Phần Dịch Vụ Sân Bay Quốc Tế Cam Ranh,DV Sân Bay Cam Ranh,
CID.VN,CID.VN,Công ty Cổ phần Xây dựng và Phát triển Cơ sở Hạ tầng,Xây dựng và Phát triển Cơ sở Hạ tầng,
CIG.VN,CIG.VN,Công ty Cổ phần COMA 18,Xây dựng COMA 18,
CII.VN,CII.VN,Công ty Cổ phần Đầu tư Hạ tầng Kỹ thuật Thành phố Hồ Chí Minh,Hạ tầng Kỹ thuật TP.HCM,
CIP.VN,CIP.VN,Công ty Cổ phần Xây lắp và Sản xuất Công nghiệp,XL và SX công nghiệp,
CJC.VN,CJC.VN,Công ty Cổ phần Cơ điện Miền Trung,Cơ điện Miền Trung,
CK8.VN,CK8.VN,Công ty Cổ phần Cơ khí 120,Cơ khí 120,
CKA.VN,CKA.VN,Công ty Cổ phần Cơ khí An Giang,Cơ khí An Giang,
CKD.VN,CKD.VN,Công ty Cổ phần Cơ khí Đông Anh Licogi,Đông Anh Licogi,
CKG.VN,CKG.VN,Công ty Cổ phần Tập đoàn CIC,Tập đoàn CIC,
CKV.VN,CKV.VN,Công ty Cổ phần CokyVina,CokyVina,
CLC.VN,CLC.VN,Công ty Cổ phần Cát Lợi,Thuốc lá Cát Lợi,
CLH.VN,CLH.VN,Công ty Cổ phần Xi măng La Hiên VVMI,Xi măng La Hiên,
CLI.VN,CLI.VN,Cổ phiếu Công ty cổ phần Tập đoàn CNCTech,Cổ phiếu Công ty cổ phần Tập đoàn CNCTech,
CLL.VN,CLL.VN,Công ty Cổ phần Cảng Cát Lái,Cảng Cát Lái,
CLM.VN,CLM.VN,Công ty Cổ phần Xuất nhập khẩu Than - Vinacomin,Xuất nhập khẩu Than - Vinacomin,
CLW.VN,CLW.VN,Công ty Cổ phần Cấp nước Chợ Lớn,Cấp nước Chợ Lớn,
CLX.VN,CLX.VN,Công ty Cổ phần Xuất nhập khẩu và Đầu tư Chợ Lớn (CHOLIMEX),XNK và ĐT Chợ Lớn (CHOLIMEX),
CMC.VN,CMC.VN,Công ty Cổ phần Đầu tư CMC,Đầu tư CMC,
CMD.VN,CMD.VN,Công ty Cổ phần Vật liệu xây dựng và Trang trí nội thất TP Hồ Chí Minh,VLXD và Nội thất TP.HCM,
CMF.VN,CMF.VN,Công ty Cổ phần Thực phẩm Cholimex,Thực phẩm Cholimex,
CMG.VN,CMG.VN,Công ty Cổ phần Tập đoàn Công nghệ CMC,Tập đoàn Công nghệ CMC,
CMI.VN,CMI.VN,Công ty Cổ phần CMISTONE Việt Nam,CMISTONE Việt Nam,
CMK.VN,CMK.VN,Công ty Cổ phần Cơ khí Mạo Khê - Vinacomin,Cơ khí Mạo Khê - Vinacomin,
CMM.VN,CMM.VN,Công ty Cổ phần Camimex,Camimex,
CMN.VN,CMN.VN,Công ty Cổ phần Lương thực Thực phẩm Colusa - Miliket,Colusa -  Miliket,
CMP.VN,CMP.VN,Công ty Cổ phần Cảng Chân Mây,Cảng Chân Mây,
CMS.VN,CMS.VN,Công ty Cổ phần Tập đoàn CMH Việt Nam,Tập đoàn CMH Việt Nam,
CMT.VN,CMT.VN,Công ty Cổ phần Công nghệ mạng và Truyền thông,CN mạng và Truyền thông,
CMV.VN,CMV.VN,Công ty Cổ phần Thương nghiệp Cà Mau,Thương nghiệp Cà Mau,
CMW.VN,CMW.VN,Công ty Cổ phần Cấp nước Cà Mau,Cấp nước Cà Mau,
CMX.VN,CMX.VN,Công ty Cổ phần CAMIMEX Group,CAMIMEX Group,
CNA.VN,CNA.VN,Công ty Cổ phần Tổng công ty Chè Nghệ An,Tổng công ty Chè Nghệ An - CTCP,
CNC.VN,CNC.VN,Công ty Cổ phần Công nghệ cao Traphaco,Công nghệ cao Traphaco,
CNG.VN,CNG.VN,Công ty Cổ phần CNG Việt Nam,CNG Việt Nam,
CNN.VN,CNN.VN,"Công ty Cổ phần Tư vấn Công nghệ, Thiết bị và Kiểm định Xây dựng - CONINCO",Xây dựng Coninco,
CNT.VN,CNT.VN,Công ty Cổ phần Tập đoàn CNT,Tập đoàn CNT,
COM.VN,COM.VN,Công ty Cổ phần Vật tư - Xăng dầu,Vật tư - Xăng dầu,
CPA.VN,CPA.VN,Công ty Cổ phần Cà phê Phước An,Cà phê Phước An,
CPC.VN,CPC.VN,Công ty Cổ phần Thuốc sát trùng Cần Thơ,Thuốc sát trùng Cần Thơ,
CPH.VN,CPH.VN,Công ty Cổ phần Phục vụ Mai táng Hải Phòng,PV mai táng Hải Phòng,
CPI.VN,CPI.VN,Công ty Cổ phần Đầu tư Cảng Cái Lân,Đầu tư Cảng Cái Lân,
CQN.VN,CQN.VN,Công ty Cổ phần Cảng Quảng Ninh,Cảng Quảng Ninh,
CQT.VN,CQT.VN,Công ty Cổ phần Xi măng Quán Triều VVMI,Xi măng Quán Triều VVMI,
CRC.VN,CRC.VN,Công ty Cổ phần Create Capital Việt Nam,Create Capital Việt Nam,
CRE.VN,CRE.VN,Công ty Cổ phần Bất động sản Thế Kỷ,Bất động sản Thế Kỷ,
CRV.VN,CRV.VN,Công ty Cổ phần Tập đoàn Bất động sản CRV,Tập đoàn Bất động sản CRV,
CSC.VN,CSC.VN,Công ty Cổ phần Tập đoàn COTANA,Tập đoàn COTANA,
CSI.VN,CSI.VN,Công ty Cổ phần Chứng khoán Kiến thiết Việt Nam,Chứng khoán Kiến thiết VN,
CSM.VN,CSM.VN,Công ty Cổ phần Công nghiệp Cao su Miền Nam,Cao su Miền Nam,
CST.VN,CST.VN,Công ty Cổ phần Than Cao Sơn - TKV,Than Cao Sơn - TKV,
CSV.VN,CSV.VN,Công ty Cổ phần Hóa chất Cơ bản miền Nam,Hóa chất Cơ bản miền Nam,
CT3.VN,CT3.VN,Công ty Cổ phần Đầu tư và Xây dựng công trình 3,Xây dựng công trình 3,
CT6.VN,CT6.VN,Công ty Cổ phần Công trình 6,Công trình 6,
CTB.VN,CTB.VN,Công ty Cổ phần Chế tạo Bơm Hải Dương,Bơm Hải Dương,
CTD.VN,CTD.VN,Công ty Cổ phần Xây dựng Coteccons,Xây dựng Coteccons,
CTF.VN,CTF.VN,Công ty Cổ phần City Auto,City Auto,
CTG.VN,CTG.VN,Ngân hàng Thương mại Cổ phần Công thương Việt Nam,VietinBank,VietinBank
CTI.VN,CTI.VN,Công ty Cổ phần Đầu tư Phát triển Cường Thuận IDICO,Cường Thuận IDICO,
CTP.VN,CTP.VN,Công ty Cổ phần Tập đoàn CTP Group,CTP Group,
CTR.VN,CTR.VN,Tổng Công ty Cổ phần Công trình Viettel,Công trình Viettel,
CTS.VN,CTS.VN,Công ty Cổ phần Chứng khoán Vietinbank,Chứng khoán Vietinbank,
CTT.VN,CTT.VN,Công ty Cổ phần Chế tạo máy - Vinacomin,Chế tạo máy - Vinacomin,
CTW.VN,CTW.VN,Công ty Cổ phần Cấp thoát nước Cần Thơ,Cấp thoát nước Cần Thơ,
CTX.VN,CTX.VN,Tổng Công ty Cổ phần Đầu tư Xây dựng và Thương mại Việt Nam,CONSTREXIM,
CVN.VN,CVN.VN,Công ty Cổ phần Vinam,Vinam Group,
CVT.VN,CVT.VN,Công ty Cổ phần CMC,CMC JSC,
CX8.VN,CX8.VN,Công ty Cổ phần Đầu tư và Xây lắp Constrexim số 8,Constrexim số 8,
CYC.VN,CYC.VN,Công ty Cổ phần Gạch men Chang Yih,Gạch men Chang YIH,
D11.VN,D11.VN,Công ty Cổ phần Địa ốc 11,Địa ốc 11,
D2D.VN,D2D.VN,Công ty Cổ phần Phát triển Đô thị Công nghiệp số 2,Phát triển Đô thị số 2,
DAC.VN,DAC.VN,Công ty Cổ phần 382 Đông Anh,CTCP 382 Đông Anh,
DAD.VN,DAD.VN,Công ty Cổ phần Đầu tư và Phát triển Giáo dục Đà Nẵng,Phát triển GD Đà Nẵng,
DAE.VN,DAE.VN,Công ty Cổ phần Sách Giáo dục tại Thành phố Đà Nẵng,Sách Giáo dục Đà Nẵng,
DAG.VN,DAG.VN,Công ty Cổ phần Tập đoàn Nhựa Đông Á,TĐ Nhựa Đông Á,
DAH.VN,DAH.VN,Công ty Cổ phần Tập đoàn Khách sạn Đông Á,Tập đoàn Khách sạn Đông Á,
DAN.VN,DAN.VN,Công ty Cổ phần Dược Danapha,Dược Danapha,
DAS.VN,DAS.VN,Công ty Cổ phần Máy - Thiết bị Dầu khí Đà Nẵng,Thiết bị Dầu khí Đà Nẵng,
DAT.VN,DAT.VN,Công ty Cổ phần Đầu tư Du lịch và Phát triển Thủy sản,ĐT Du lịch và PT Thủy sản,
DBC.VN,DBC.VN,Công ty Cổ phần Tập đoàn Dabaco Việt Nam,Tập đoàn DABACO,
DBD.VN,DBD.VN,Công ty Cổ phần Dược - Trang thiết bị y tế Bình Định (BIDIPHAR),Dược - TB Y tế Bình Định,
DBM.VN,DBM.VN,Công ty Cổ phần Dược - Vật tư Y tế Đắk Lắk,BAMEPHARM,
DBT.VN,DBT.VN,Công ty Cổ phần Dược phẩm Bến Tre,Dược phẩm Bến Tre,
DC1.VN,DC1.VN,Công ty Cổ phần Đầu tư Phát triển Xây dựng số 1,Phát triển Xây dựng số 1 (DIC1),
DC2.VN,DC2.VN,Công ty Cổ phần Đầu tư Phát triển - Xây dựng (DIC) số 2,DIC Số 2,
DC4.VN,DC4.VN,Công ty Cổ phần Dicera Holdings,Dicera Holdings,
