ts_code,symbol,name,enname,aliases
HRC.VN,HRC.VN,Công ty Cổ phần Cao su Hòa Bình,Cao su Hòa Bình,
HSA.VN,HSA.VN,Công ty Cổ phần HESTIA,HESTIA,
HSG.VN,HSG.VN,Công ty Cổ phần Tập đoàn Hoa Sen,Tập đoàn Hoa Sen,
HSL.VN,HSL.VN,Công ty Cổ phần Đầu tư Phát triển Thực phẩm Hồng Hà,Thực phẩm Hồng Hà,
HSM.VN,HSM.VN,Tổng Công ty Cổ phần Dệt May Hà Nội,HANOSIMEX,
HSP.VN,HSP.VN,Công ty Cổ phần Sơn Tổng hợp Hà Nội,Sơn Tổng hợp Hà Nội,
HSV.VN,HSV.VN,Công ty Cổ phần Tập đoàn HSV Việt Nam,Tập đoàn HSV Việt Nam,
HT1.VN,HT1.VN,Công ty Cổ phần Xi măng VICEM Hà Tiên,VICEM Hà Tiên,
HTC.VN,HTC.VN,Công ty Cổ phần Thương mại Hóc Môn,Thương mại Hóc Môn,
HTE.VN,HTE.VN,Công ty Cổ phần Đầu tư Kinh doanh Điện lực Thành phố Hồ Chí Minh,Kinh doanh điện lực TP HCM,
HTG.VN,HTG.VN,Tổng Công ty Cổ phần Dệt may Hòa Thọ,Dệt may Hòa Thọ,
HTI.VN,HTI.VN,Công ty Cổ phần Đầu tư Phát triển Hạ tầng IDICO,PT Hạ tầng IDICO,
HTL.VN,HTL.VN,Công ty Cổ phần Kỹ thuật và Ô tô Trường Long,Ô tô Trường Long,
HTM.VN,HTM.VN,Tổng Công ty Thương mại Hà Nội – Công ty cổ phần,Thương mại Hà Nội - Hapro,
HTN.VN,HTN.VN,Công ty Cổ phần Hưng Thịnh Incons,Hưng Thịnh Incons,
HTP.VN,HTP.VN,Công ty Cổ phần In Sách Giáo Khoa Hòa Phát,In SGK Hòa Phát,
HTT.VN,HTT.VN,Công ty Cổ phần Thương mại Hà Tây,Thương mại Hà Tây,
HTV.VN,HTV.VN,Công ty Cổ phần Logistics Vicem,Logistics Vicem,
HU1.VN,HU1.VN,Công ty Cổ phần Đầu tư và Xây dựng HUD1,Xây dựng HUD1,
HU3.VN,HU3.VN,Công ty Cổ phần Đầu tư và Xây dựng HUD3,Xây dựng HUD3,
HU4.VN,HU4.VN,Công ty Cổ phần Đầu tư và Xây dựng HUD4,Đầu tư và Xây dựng HUD4,
HU6.VN,HU6.VN,Công ty Cổ phần Đầu tư Phát triển Nhà và Đô thị HUD6,PT Nhà và Đô thị HUD6,
HUB.VN,HUB.VN,Công ty Cổ phần Xây lắp Thừa Thiên Huế,Xây lắp Huế,
HUG.VN,HUG.VN,Tổng công ty May Hưng Yên - Công ty Cổ phần,May Hưng Yên,
HUT.VN,HUT.VN,Công ty Cổ phần Tasco,Tasco- CTCP,
HVA.VN,HVA.VN,Công ty Cổ phần Đầu tư HVA,Đầu tư HVA,
HVH.VN,HVH.VN,Công ty Cổ phần Đầu tư và Công nghệ HVC,Đầu tư và Công nghệ HVC,
HVN.VN,HVN.VN,Tổng Công ty Hàng không Việt Nam - CTCP,Vietnam Airlines,
HVT.VN,HVT.VN,Công ty Cổ phần Hóa chất Việt Trì,Hóa chất Việt trì,
HVX.VN,HVX.VN,Công ty Cổ phần Xi măng Vicem Hải Vân,Xi măng Vicem Hải Vân,
HWS.VN,HWS.VN,Công ty Cổ phần Cấp nước Huế,Cấp nước Huế,
IBD.VN,IBD.VN,Công ty Cổ phần In Tổng hợp Bình Dương,In Tổng hợp Bình Dương,
ICC.VN,ICC.VN,Công ty Cổ phần Xây dựng Công nghiệp,Xây dựng công nghiệp,
ICF.VN,ICF.VN,Công ty Cổ phần Đầu tư - Thương mại - Thuỷ sản,ĐT TM Thủy sản,
ICG.VN,ICG.VN,Công ty Cổ phần Xây dựng Sông Hồng,Xây dựng Sông Hồng,
ICI.VN,ICI.VN,Công ty Cổ phần Đầu tư và Xây dựng Công nghiệp,Đầu tư và XD Công nghiệp,
ICN.VN,ICN.VN,Công ty Cổ phần Đầu tư Xây dựng Dầu khí IDICO,XD Dầu Khí IDICO,
ICT.VN,ICT.VN,Công ty Cổ phần Viễn thông - Tin học Bưu điện,Viễn thông - Tin học Bưu điện,
IDC.VN,IDC.VN,Tổng Công ty IDICO - CTCP,IDICO,
IDI.VN,IDI.VN,Công ty Cổ phần Đầu tư và Phát triển Đa Quốc Gia I.D.I,Đầu tư và PT Đa Quốc Gia I.D.I,
IDJ.VN,IDJ.VN,Công ty Cổ phần Đầu tư IDJ Việt Nam,Đầu tư IDJ Việt Nam,
IDP.VN,IDP.VN,Công ty Cổ phần Sữa Quốc tế LOF,Sữa Quốc tế LOF,
IDV.VN,IDV.VN,Công ty Cổ phần Phát triển Hạ tầng Vĩnh Phúc,PT Hạ tầng Vĩnh Phúc,
IFS.VN,IFS.VN,Công ty Cổ phần Thực phẩm Quốc tế,Thực phẩm Quốc tế,
IJC.VN,IJC.VN,Công ty Cổ phần Phát triển Hạ tầng Kỹ thuật,Becamex IJC,
ILA.VN,ILA.VN,Công ty Cổ phần ILA,Công ty ILA,
ILB.VN,ILB.VN,Công ty Cổ phần ICD Tân Cảng - Long Bình,ICD Tân Cảng Long Bình,
ILC.VN,ILC.VN,Công ty Cổ phần Hợp tác lao động với nước ngoài,Hợp tác lao động với nước ngoài,
ILS.VN,ILS.VN,Công ty Cổ phần Đầu tư Thương mại và Dịch vụ Quốc tế,TM và Dịch vụ Quốc tế,
IME.VN,IME.VN,Công ty Cổ phần Cơ khí và Xây lắp Công nghiệp,Xây lắp Công nghiệp,
IMP.VN,IMP.VN,Công ty Cổ phần Dược phẩm Imexpharm,Dược phẩm Imexpharm,
IN4.VN,IN4.VN,Công ty Cổ phần In số 4,In số 4,
INC.VN,INC.VN,Công ty Cổ phần Tư vấn Đầu tư IDICO,Tư vấn Đầu tư IDICO,
INN.VN,INN.VN,Công ty Cổ phần Bao bì và In Nông nghiệp,Bao bì và In Nông Nghiệp,
IPA.VN,IPA.VN,Công ty Cổ phần Tập đoàn Đầu tư I.P.A,Tập đoàn Đầu tư I.P.A,
IRC.VN,IRC.VN,Công ty Cổ phần Cao su Công nghiệp,Cao su Công nghiệp,
ISG.VN,ISG.VN,Công ty Cổ phần Vận tải biển và Hợp tác lao động Quốc Tế,Vận tải biển và Hợp tác LĐ Quốc Tế,
ISH.VN,ISH.VN,Công ty Cổ phần Thủy điện Srok Phu Miêng IDICO,Thủy điện Srok Phu Miêng,
IST.VN,IST.VN,Công ty Cổ phần ICD Tân Cảng Sóng Thần,ICD Tân Cảng Sóng Thần,
ITA.VN,ITA.VN,Công ty Cổ phần Đầu tư và Công nghiệp Tân Tạo,Đầu tư CN Tân Tạo,
ITC.VN,ITC.VN,Công ty Cổ phần Đầu tư - Kinh doanh nhà,Đầu tư kinh doanh Nhà,
ITD.VN,ITD.VN,Công ty Cổ phần Công nghệ ITD,Công nghệ ITD,
ITQ.VN,ITQ.VN,Công ty Cổ phần Tập đoàn Thiên Quang,Tập đoàn Thiên Quang,
ITS.VN,ITS.VN,"Công ty Cổ phần Đầu tư, Thương mại và Dịch vụ - Vinacomin",Thương mại và DV - Vinacomin,
IVS.VN,IVS.VN,Công ty Cổ phần Chứng khoán Guotai Junan (Việt Nam),Chứng khoán Guotai Junan (Việt Nam),
JOS.VN,JOS.VN,Công ty Cổ phần Chế biến Thủy sản Xuất khẩu Minh Hải,Thủy sản Minh Hải,
JVC.VN,JVC.VN,Công ty Cổ phần Đầu tư Y tế - Dược phẩm Việt Nam,Đầu tư Y tế - Dược phẩm Việt Nam,
KBC.VN,KBC.VN,Tổng Công ty Phát triển Đô thị Kinh Bắc - CTCP,TCT Đô thị Kinh Bắc,
KCB.VN,KCB.VN,Công ty Cổ phần Khoáng Sản và Luyện Kim Cao Bằng,Khoáng Sản Luyện Kim Cao Bằng,
KDC.VN,KDC.VN,Công ty Cổ phần Tập đoàn KIDO,Tập đoàn KIDO,
KDH.VN,KDH.VN,Công ty Cổ phần Đầu tư và Kinh doanh nhà Khang Điền,Nhà Khang Điền,
KDM.VN,KDM.VN,Công ty Cổ phần Tập đoàn GCL,Tập đoàn GCL,
KGM.VN,KGM.VN,Công ty Cổ phần Xuất nhập khẩu Kiên Giang,XNK Kiên Giang,
KHD.VN,KHD.VN,"Công ty Cổ phần Khai thác, Chế biến Khoáng sản Hải Dương",Khoáng sản Hải Dương,
KHG.VN,KHG.VN,Công ty Cổ phần Tập đoàn Khải Hoàn Land,Tập đoàn Khải Hoàn Land,
KHP.VN,KHP.VN,Công ty Cổ phần Điện lực Khánh Hòa,Điện lực Khánh Hòa,
KHS.VN,KHS.VN,Công ty Cổ phần Kiên Hùng,Thủy sản Kiên Hùng,
KHW.VN,KHW.VN,Công ty Cổ phần Cấp thoát nước Khánh Hòa,Cấp thoát nước Khánh Hòa,
KHX.VN,KHX.VN,Công ty Cổ phần Phát hành sách Khánh Hoà,Fahasa Khanh Hoa,
KIP.VN,KIP.VN,Công ty Cổ phần K.I.P Việt Nam,K.I.P Việt Nam,
KKC.VN,KKC.VN,Công ty Cổ phần Tập đoàn Thành Thái,Tập đoàn Thành Thái,
KLB.VN,KLB.VN,Ngân hàng Thương mại Cổ phần Kiên Long,KienlongBank,
KMR.VN,KMR.VN,Công ty Cổ phần Mirae,MIRAE,
KMT.VN,KMT.VN,Công ty Cổ phần Kim khí Miền Trung,Kim khí Miền Trung,
KOS.VN,KOS.VN,Công ty Cổ phần KOSY,Công ty KOSY,
KPF.VN,KPF.VN,Công ty Cổ phần Đầu tư Tài sản KOJI,Đầu tư Tài sản KOJI,
KSB.VN,KSB.VN,Công ty Cổ phần Khoáng sản và Xây dựng Bình Dương,Khoáng sản Bình Dương,
KSD.VN,KSD.VN,Công ty Cổ phần Đầu tư DNA,Đầu tư DNA,
KSF.VN,KSF.VN,Công ty Cổ phần Tập đoàn Sunshine,Tập đoàn Sunshine,
KSQ.VN,KSQ.VN,Công ty Cổ phần CNC Capital Việt Nam,CNC Capital Việt Nam,
KST.VN,KST.VN,Công ty Cổ phần KASATI,KASATI,
KSV.VN,KSV.VN,Tổng Công ty Khoáng sản TKV - Công ty Cổ phần,Khoáng sản TKV,
KTC.VN,KTC.VN,Công ty Cổ phần Thương mại Kiên Giang,Thương mại Kiên Giang,
KTL.VN,KTL.VN,Công ty Cổ phần Kim khí Thăng Long,Kim khí Thăng Long,
KTS.VN,KTS.VN,Công ty Cổ phần Đường Kon Tum,Đường Kon Tum,
KTT.VN,KTT.VN,Công ty Cổ phần Tập đoàn Đầu tư KTT,Tập đoàn Đầu tư KTT,
KVC.VN,KVC.VN,Công ty Cổ phần Sản xuất Xuất nhập khẩu Inox Kim Vĩ,XNK Inox Kim Vĩ,
L10.VN,L10.VN,Công ty Cổ phần Lilama 10,LILAMA 10,
L12.VN,L12.VN,Công ty Cổ phần Licogi 12,LICOGI 12,
L14.VN,L14.VN,Công ty Cổ phần Licogi 14,Licogi 14,
L18.VN,L18.VN,Công ty Cổ phần Đầu tư và Xây dựng số 18,LICOGI - 18,
L35.VN,L35.VN,Công ty Cổ phần Cơ khí Lắp máy Lilama,Cơ khí Lilama,
L40.VN,L40.VN,Công ty Cổ phần Đầu tư và Xây dựng 40,Đầu tư và Xây dựng 40,
L43.VN,L43.VN,Công ty Cổ phần Lilama 45.3,LILAMA 45.3,
L45.VN,L45.VN,Công ty Cổ phần Lilama 45.1,Lilama 45.1,
L61.VN,L61.VN,Công ty Cổ phần Lilama 69-1,LILAMA 69-1,
L62.VN,L62.VN,Công ty Cổ phần Lilama 69 - 2,LILAMA 69.2,
L63.VN,L63.VN,Công ty Cổ phần Lilama 69-3,Lilama 69-3,
LAF.VN,LAF.VN,Công ty Cổ phần Chế biến Hàng Xuất khẩu Long An,Chế biến Hàng XK Long An,
LAI.VN,LAI.VN,Công ty Cổ phần Đầu tư Xây dựng Long An IDICO,XD Long An IDICO,
LAS.VN,LAS.VN,Công ty Cổ phần Supe Phốt phát và Hóa chất Lâm Thao,Hóa chất Lâm Thao,
LAW.VN,LAW.VN,Công ty Cổ phần Cấp thoát nước Long An,Cấp thoát nước Long An,
LBE.VN,LBE.VN,Công ty Cổ phần Thương mại và Dịch vụ LVA,Thương mại và Dịch vụ LVA,
LBM.VN,LBM.VN,Công ty Cổ phần Khoáng sản và Vật liệu xây dựng Lâm Đồng,Khoáng sản Lâm Đồng,
LCD.VN,LCD.VN,Công ty Cổ phần Lắp máy - Thí nghiệm cơ điện,Thí nghiệm cơ điện,
LCG.VN,LCG.VN,Công ty Cổ phần Lizen,LIZEN,
LCM.VN,LCM.VN,Công ty Cổ phần Khai thác và Chế biến Khoáng sản Lào Cai,Khoáng sản Lào Cai,
LDG.VN,LDG.VN,Công ty Cổ phần Đầu tư LDG,Đầu tư LDG,
LDP.VN,LDP.VN,Công ty Cổ phần Dược Lâm Đồng - Ladophar,Dược Lâm Đồng - Ladophar,
LDW.VN,LDW.VN,Công ty Cổ phần Cấp thoát nước Lâm Đồng,Cấp thoát nước Lâm Đồng,
LEC.VN,LEC.VN,Công ty Cổ phần Bất động sản Điện lực Miền Trung,BĐS Điện lực Miền Trung,
LG9.VN,LG9.VN,Công ty Cổ phần Cơ giới và Xây lắp số 9,Cơ giới và XL số 9 (Licogi 9),
LGC.VN,LGC.VN,Công ty Cổ phần Đầu tư Cầu đường CII,Đầu tư Cầu đường CII,
LGL.VN,LGL.VN,Công ty Cổ phần Đầu tư và Phát triển Đô thị Long Giang,Long Giang Land,
LHC.VN,LHC.VN,Công ty Cổ phần Đầu tư và Xây dựng Thủy lợi Lâm Đồng,XD Thủy lợi Lâm Đồng,
LHG.VN,LHG.VN,Công ty Cổ phần Long Hậu,KCN Long Hậu,
LIC.VN,LIC.VN,Tổng Công ty LICOGI - Công ty Cổ phần,LICOGI,
LIG.VN,LIG.VN,Công ty Cổ phần Licogi 13,Licogi 13,
LIX.VN,LIX.VN,Công ty Cổ phần Bột Giặt LIX,Bột Giặt LIX,
LKW.VN,LKW.VN,Công ty Cổ phần Cấp nước Long Khánh,Cấp nước Long Khánh,
LLM.VN,LLM.VN,Tổng Công ty lắp máy Việt Nam - Công ty Cổ phần,LILAMA,
LM3.VN,LM3.VN,Công ty Cổ phần Lilama 3,Lilama 3,
LM7.VN,LM7.VN,Công ty Cổ phần Lilama 7,LILAMA 7,
LM8.VN,LM8.VN,Công ty Cổ phần Lilama 18,LILAMA 18,
LMC.VN,LMC.VN,Công ty Cổ phần Long Beach LMC,Khoáng sản LATCA,
LMH.VN,LMH.VN,Công ty Cổ phần Quốc Tế Holding,CTCP Quốc Tế Holding,
LMI.VN,LMI.VN,Công ty Cổ phần Đầu tư Xây dựng Lắp máy IDICO,Lắp máy IDICO,
LNC.VN,LNC.VN,Công ty Cổ phần Lệ Ninh,Lệ Ninh - Quảng Bình,
LO5.VN,LO5.VN,Công ty Cổ phần Lilama 5,LILAMA 5,
LPB.VN,LPB.VN,Ngân hàng Thương mại Cổ phần Lộc Phát Việt Nam,LPBank,
LPT.VN,LPT.VN,Công ty Cổ phần Thương mại và Sản xuất Lập Phương Thành,TM và SX Lập Phương Thành,
LQN.VN,LQN.VN,Công ty Cổ phần Licogi Quảng Ngãi,Licogi Quảng Ngãi,
LSG.VN,LSG.VN,Công ty Cổ phần Bất động sản Sài Gòn Vi na,BĐS Sài Gòn Vina,
LSS.VN,LSS.VN,Công ty Cổ phần Mía đường Lam Sơn,Mía đường Lam Sơn,
LTC.VN,LTC.VN,Công ty Cổ phần Điện nhẹ Viễn Thông,Điện nhẹ Viễn thông,
LTG.VN,LTG.VN,Công ty Cổ phần Tập đoàn Lộc Trời,Tập đoàn Lộc Trời (BVTV An Giang),
LUT.VN,LUT.VN,Công ty Cổ phần Đầu tư Xây dựng Lương Tài,Đầu tư Xây dựng Lương Tài,
M10.VN,M10.VN,Tổng công ty May 10 - Công ty Cổ phần,Tổng công ty May 10,
MA1.VN,MA1.VN,Công ty Cổ phần Thiết bị,MACHINCO1,
MAC.VN,MAC.VN,Công ty Cổ phần Tập đoàn Macstar,Tập đoàn Macstar,
MAS.VN,MAS.VN,Công ty cổ phần Dịch vụ Hàng Không Sân Bay Đà Nẵng,Sân bay Đà Nẵng,
MBB.VN,MBB.VN,Ngân hàng Thương mại Cổ phần Quân đội,MBBank,MB Bank|MBBank
MBG.VN,MBG.VN,Công ty Cổ phần Tập đoàn MBG,Tập đoàn MBG,
MBN.VN,MBN.VN,Công ty Cổ phần Môi trường và Công trình đô thị Bắc Ninh,Môi trường và Công trình ĐT Bắc Ninh,
MBS.VN,MBS.VN,Công ty Cổ phần Chứng khoán MB,Chứng khoán MB,
MBT.VN,MBT.VN,Công ty Cổ phần Bất động sản cho thuê Minh Bảo Tín,BĐS cho thuê Minh Bảo Tín,
MCC.VN,MCC.VN,Công ty Cổ phần Gạch ngói cao cấp,Gạch ngói cao cấp,
MCF.VN,MCF.VN,Công ty Cổ phần Xây lắp Cơ khí và Lương thực Thực phẩm,Cơ khí và Lương thực Thực phẩm,
MCG.VN,MCG.VN,Công ty Cổ phần Năng lượng và Bất động sản MCG,Năng lượng và Bất động sản MCG,
MCH.VN,MCH.VN,Công ty Cổ phần Hàng Tiêu Dùng MaSan,Hàng Tiêu Dùng MaSan,
MCM.VN,MCM.VN,Công ty Cổ phần Giống bò sữa Mộc Châu,Giống bò sữa Mộc Châu,
MCO.VN,MCO.VN,Công ty Cổ phần Đầu tư và Xây dựng BDC Việt Nam,BDC Việt Nam,
MCP.VN,MCP.VN,Công ty Cổ phần In và Bao bì Mỹ Châu,In và Bao bì Mỹ Châu,
MDA.VN,MDA.VN,Công ty Cổ phần Môi trường Đô thị Đông Anh,Môi trường Đô thị Đông Anh,
MDC.VN,MDC.VN,Công ty Cổ phần Than Mông Dương - Vinacomin,Than Mông Dương,
MDF.VN,MDF.VN,Công ty Cổ phần Gỗ MDF VRG - Quảng Trị,Gỗ MDF VRG - Quảng Trị,
MDG.VN,MDG.VN,Công ty Cổ phần Miền Đông,Xây dựng Miền Đông,
MEC.VN,MEC.VN,Công ty Cổ phần Cơ khí - Lắp máy Sông Đà,Lắp máy Sông Đà,
MED.VN,MED.VN,Công ty Cổ phần Dược Trung ương Mediplantex,Dược Mediplantex,
MEF.VN,MEF.VN,Công ty Cổ phần MEINFA,MEINFA,
MEL.VN,MEL.VN,Công ty Cổ phần Thép Mê Lin,Thép Mê Lin,
MES.VN,MES.VN,Công ty Cổ phần Cơ điện Công trình,Cơ điện Công trình,
MFS.VN,MFS.VN,Công ty Cổ phần Dịch vụ kỹ thuật Mobifone,Mobifone Service,
MGC.VN,MGC.VN,Công ty Cổ phần Địa chất mỏ - TKV,Địa chất mỏ - TKV,
MGG.VN,MGG.VN,Tổng Công ty Đức Giang - Công ty Cổ phần,May Đức Giang,
MGR.VN,MGR.VN,Công ty cổ phần Tập đoàn MGROUP,Tập đoàn MGROUP,
MH3.VN,MH3.VN,Công ty Cổ phần Khu công nghiệp Cao su Bình Long,KCN Cao su Bình Long,
MHC.VN,MHC.VN,Công ty Cổ phần MHC,CTCP MHC,
MHL.VN,MHL.VN,Công ty Cổ phần Minh Hữu Liên,Minh Hữu Liên,
MIC.VN,MIC.VN,Công ty Cổ phần Kỹ nghệ Khoáng sản Quảng Nam,Khoáng sản Quảng Nam,
MIE.VN,MIE.VN,Tổng Công ty Máy và Thiết bị Công nghiệp - CTCP,Máy và Thiết bị Công nghiệp,
MIG.VN,MIG.VN,Tổng Công ty Cổ phần Bảo hiểm Quân đội,Bảo hiểm Quân đội,
MKP.VN,MKP.VN,Công ty Cổ phần Hóa - Dược phẩm Mekophar,Dược phẩm Mekophar,
MKV.VN,MKV.VN,Công ty Cổ phần Dược Thú Y Cai Lậy,Dược Thú Y Cai Lậy,
MLC.VN,MLC.VN,Công ty Cổ phần Môi trường Đô thị Tỉnh Lào Cai,Môi trường Đô thị Tỉnh Lào Cai,
MLS.VN,MLS.VN,Công ty Cổ phần Chăn nuôi - Mitraco,Chăn nuôi Mitraco,
MML.VN,MML.VN,Công ty Cổ phần Masan MEATLife,Masan MEATLife,
MNB.VN,MNB.VN,Tổng Công ty May Nhà Bè - Công ty Cổ phần,May Nhà Bè,
MND.VN,MND.VN,Công ty Cổ phần Môi trường Nam Định,Môi trường Nam Định,
MPC.VN,MPC.VN,Công ty Cổ phần Tập đoàn Thủy sản Minh Phú,Thủy sản Minh Phú,
MPT.VN,MPT.VN,Công ty Cổ phần Tập đoàn MPT,Tập đoàn MPT,
MPY.VN,MPY.VN,Công ty Cổ phần Môi trường đô thị Phú Yên,Môi trường đô thị Phú Yên,
MQB.VN,MQB.VN,Công ty Cổ phần Môi trường và Phát triển đô thị Quảng Bình,Môi trường và PT đô thị Quảng Bình,
MQN.VN,MQN.VN,Công ty Cổ phần Môi trường đô thị Quảng Ngãi,Môi trường đô thị Quảng Ngãi,
MRF.VN,MRF.VN,Công ty Cổ phần MERUFA,Cao su y tế MERUFA,
MSB.VN,MSB.VN,Ngân hàng Thương mại Cổ phần Hàng Hải Việt Nam,MSB Bank,
MSH.VN,MSH.VN,Công ty Cổ phần May Sông Hồng,May Sông Hồng,
MSN.VN,MSN.VN,Công ty Cổ phần Tập đoàn Masan,Tập đoàn Masan,Masan
MSR.VN,MSR.VN,Công ty Cổ phần Masan High-Tech Materials,Masan High-Tech Materials,
MST.VN,MST.VN,Công ty Cổ phần Đầu tư MST,Đầu tư MST,
MTA.VN,MTA.VN,Tổng Công ty Khoáng sản và Thương mại Hà Tĩnh - Công ty Cổ phần,Khoáng sản và TM Hà Tĩnh,
MTB.VN,MTB.VN,Công ty Cổ phần Môi trường và Công trình đô thị tỉnh Thái Bình,Công trình đô thị tỉnh Thái Bình,
MTG.VN,MTG.VN,Công ty Cổ phần MT Gas,MTGAS,
MTH.VN,MTH.VN,Công ty Cổ phần Môi trường Đô thị Hà Đông,Môi trường Đô thị Hà Đông,
MTL.VN,MTL.VN,Công ty Cổ phần Dịch vụ Môi trường Đô thị Từ Liêm,Môi trường Đô thị Từ Liêm,
MTP.VN,MTP.VN,Công ty Cổ phần Dược Medipharco,Dược Medipharco,
MTS.VN,MTS.VN,Công ty Cổ phần Vật tư - TKV,Vật tư - TKV,
MTV.VN,MTV.VN,Công ty Cổ phần Dịch vụ Môi trường và Công trình Đô thị Vũng Tàu,Công trình đô thị Vũng Tàu,
MVB.VN,MVB.VN,Tổng Công ty Công nghiệp mỏ Việt Bắc TKV - Công ty Cổ phần,Mỏ Việt Bắc - TKV,
MVC.VN,MVC.VN,Công ty Cổ phần Vật liệu và Xây dựng Bình Dương,VL và XD Bình Dương,
MVN.VN,MVN.VN,Tổng Công ty Hàng hải Việt Nam - CTCP,TCT Hàng hải Việt Nam,
MWG.VN,MWG.VN,Công ty Cổ phần Đầu tư Thế Giới Di Động,Thế giới di động,Mobile World|Thế Giới Di Động
NAB.VN,NAB.VN,Ngân hàng Thương mại Cổ phần Nam Á,Ngân hàng Nam Á,
NAC.VN,NAC.VN,Công ty Cổ phần Tư vấn Xây dựng Tổng hợp,Tư vấn xây dựng Tổng hợp,
NAF.VN,NAF.VN,Công ty Cổ phần Nafoods Group,Nafoods Group,
NAG.VN,NAG.VN,Công ty Cổ phần Tập đoàn Nagakawa,Tập đoàn Nagakawa,
NAP.VN,NAP.VN,Công ty Cổ phần Cảng Nghệ Tĩnh,Cảng Nghệ Tĩnh,
NAS.VN,NAS.VN,Công ty Cổ phần Dịch vụ Hàng không Sân bay Việt Nam,DV Hàng không SB Việt Nam,
NAU.VN,NAU.VN,Công ty Cổ phần Môi trường và Công trình Đô thị Nghệ An,Công trình Đô thị Nghệ An,
NAV.VN,NAV.VN,Công ty Cổ phần Nam Việt,Tấm lợp và gỗ Nam Việt,
NAW.VN,NAW.VN,Công ty Cổ phần Cấp nước Nghệ An,Cấp nước Nghệ An,
NBB.VN,NBB.VN,Công ty Cổ phần Đầu tư Năm Bảy Bảy,577 CORP,
NBC.VN,NBC.VN,Công ty Cổ phần Than Núi Béo - Vinacomin,Than Núi Béo,
NBE.VN,NBE.VN,Công ty Cổ phần Sách và Thiết bị Giáo dục Miền Bắc,Sách và Thiết bị GD Miền Bắc,
NBP.VN,NBP.VN,Công ty Cổ phần Nhiệt Điện Ninh Bình,Nhiệt điện Ninh Bình,
NBT.VN,NBT.VN,Công ty Cổ phần Cấp thoát nước Bến Tre,Cấp thoát nước Bến Tre,
NBW.VN,NBW.VN,Công ty Cổ phần Cấp nước Nhà Bè,Cấp nước Nhà Bè,
NCG.VN,NCG.VN,Công ty Cổ phần Tập đoàn Nova Consumer,Nova Consumer,
NCS.VN,NCS.VN,Công ty Cổ phần Suất ăn Hàng không Nội Bài,Suất ăn Hàng không Nội Bài,
NCT.VN,NCT.VN,Công ty Cổ phần Dịch vụ Hàng hóa Nội Bài,DV Hàng hóa Nội Bài,
ND2.VN,ND2.VN,Công ty Cổ phần Đầu tư và Phát triển điện Miền Bắc 2,Đầu tư và PT điện Miền Bắc 2,
NDC.VN,NDC.VN,Công ty Cổ phần Nam Dược,Dược phẩm Nam Dược,
NDF.VN,NDF.VN,Công ty Cổ phần Chế biến thực phẩm nông sản xuất khẩu Nam Định,Nông sản XK Nam Định,
NDN.VN,NDN.VN,Công ty Cổ phần Đầu tư Phát triển Nhà Đà Nẵng,PT Nhà Đà Nẵng,
NDP.VN,NDP.VN,Công ty Cổ phần Dược phẩm 2/9,Dược phẩm 2/9,
NDT.VN,NDT.VN,Tổng Công ty Cổ phần Dệt may Nam Định,Dệt may Nam Định,
NDW.VN,NDW.VN,Công ty Cổ phần Cấp nước Nam Định,Cấp nước Nam Định,
NDX.VN,NDX.VN,Công ty Cổ phần Xây lắp Phát triển Nhà Đà Nẵng,Phát triển Nhà Đà Nẵng,
NED.VN,NED.VN,Công ty Cổ phần Đầu tư và Phát triển Điện Tây Bắc,Phát triển Điện Tây Bắc,
NET.VN,NET.VN,Công ty Cổ phần Bột giặt Net,Bột giặt Net,
NFC.VN,NFC.VN,Công ty Cổ phần Phân lân Ninh Bình,Phân lân Ninh Bình,
NGC.VN,NGC.VN,Công ty Cổ phần Chế biến Thủy sản Xuất khẩu Ngô Quyền,Thủy sản Ngô Quyền,
NHA.VN,NHA.VN,Tổng Công ty Đầu tư Phát triển Nhà và Đô thị Nam Hà Nội,PT Nhà và Đô thị Nam HN,
NHC.VN,NHC.VN,Công ty Cổ phần Gạch ngói Nhị Hiệp,Gạch ngói Nhị Hiệp,
NHD.VN,NHD.VN,Cổ phiếu CTCP Dược phẩm Nam Hà,Cổ phiếu CTCP Dược phẩm Nam Hà,
NHH.VN,NHH.VN,Công ty Cổ phần Nhựa Hà Nội,Nhựa Hà Nội,
NHT.VN,NHT.VN,Công ty Cổ phần Sản xuất và Thương mại Nam Hoa,Sản xuất và Thương mại Nam Hoa,
NHV.VN,NHV.VN,Công ty Cổ phần Sức khỏe Hồi sinh Việt Nam,CTCP  Sức khỏe Hồi sinh Việt Nam,
NJC.VN,NJC.VN,Công ty Cổ phần May Nam Định,May Nam Định,
NKG.VN,NKG.VN,Công ty Cổ phần Thép Nam Kim,Thép Nam Kim,
NLG.VN,NLG.VN,Công ty Cổ phần Đầu tư Nam Long,BĐS Nam Long,
NLS.VN,NLS.VN,Công ty Cổ phần Cấp thoát nước Lạng Sơn,Cấp thoát nước Lạng Sơn,
NNC.VN,NNC.VN,Công ty Cổ phần Đá Núi Nhỏ,Đá Núi Nhỏ,
NNT.VN,NNT.VN,Công ty Cổ phần Cấp nước Ninh Thuận,Cấp nước Ninh Thuận,
NO1.VN,NO1.VN,Công ty Cổ phần Tâp đoàn 911,Tâp đoàn 911,
NOS.VN,NOS.VN,Công ty Cổ phần Vận tải Biển và Thương mại Phương Đông,Vận tải Biển và Thương mại Phương Đông,
NQB.VN,NQB.VN,Công ty Cổ phần Cấp nước Quảng Bình,Cấp nước Quảng Bình,
NQN.VN,NQN.VN,Công ty Cổ phần Nước sạch Quảng Ninh,Nước sạch Quảng Ninh,
NRC.VN,NRC.VN,Công ty Cổ phần Tập đoàn NRC,Tập đoàn NRC,
NSC.VN,NSC.VN,Công ty Cổ phần Tập đoàn Giống cây trồng Việt Nam,Tập đoàn Giống cây trồng Việt Nam,
NSG.VN,NSG.VN,Công ty Cổ phần Nhựa Sài Gòn,Nhựa Sài Gòn,
NSH.VN,NSH.VN,Công ty Cổ phần Tập đoàn Nhôm Sông Hồng Shalumi,Nhôm Sông Hồng,
NSL.VN,NSL.VN,Công ty Cổ phần Cấp nước Sơn La,Cấp nước Sơn La,
NSS.VN,NSS.VN,Công ty Cổ phần Nông súc sản Đồng Nai,Nông súc sản Đồng Nai,
NST.VN,NST.VN,Công ty Cổ phần Ngân Sơn,Thuốc lá Ngân Sơn,
NT2.VN,NT2.VN,Công ty Cổ phần Điện lực Dầu khí Nhơn Trạch 2,Điện lực Nhơn Trạch 2,
NTC.VN,NTC.VN,Công ty Cổ phần Khu Công nghiệp Nam Tân Uyên,KCN Nam Tân Uyên,
NTF.VN,NTF.VN,Công ty Cổ phần Dược - Vật tư y tế Nghệ An,Dược Nghệ An,
NTH.VN,NTH.VN,Công ty Cổ phần Thủy điện Nước Trong,Thủy điện Nước Trong,
NTL.VN,NTL.VN,Công ty Cổ phần Phát triển Đô thị Từ Liêm,Đô thị Từ Liêm,
NTP.VN,NTP.VN,Công ty Cổ phần Nhựa Thiếu niên Tiền Phong,Nhựa Tiền Phong,
NTT.VN,NTT.VN,Công ty Cổ phần Dệt - May Nha Trang,Dệt - May Nha Trang,
NTW.VN,NTW.VN,Công ty Cổ phần Cấp nước Nhơn Trạch,Cấp nước Nhơn Trạch,
NUE.VN,NUE.VN,Công ty Cổ phần Môi trường Đô thị Nha Trang,Môi trường Đô thị Nha Trang,
NVB.VN,NVB.VN,Ngân hàng Thương mại Cổ phần Quốc Dân,Ngân hàng Quốc Dân,
NVL.VN,NVL.VN,Công ty Cổ phần Tập đoàn Đầu tư Địa ốc No Va,Novaland,
NVP.VN,NVP.VN,Công ty Cổ phần Nước sạch Vĩnh Phúc,Nước sạch Vĩnh Phúc,
NVT.VN,NVT.VN,Công ty Cổ phần Bất động sản Du lịch Ninh Vân Bay,Ninh Vân Bay,
NWT.VN,NWT.VN,Công ty Cổ phần Vận tải Newway,Vận tải Newway,
NXT.VN,NXT.VN,Công ty Cổ phần Sản xuất và Cung ứng vật liệu xây dựng Kon Tum,SX và Cung ứng VLXD Kon Tum,
OCB.VN,OCB.VN,Ngân hàng Thương mại Cổ phần Phương Đông,Ngân hàng Phương Đông,
OCH.VN,OCH.VN,Công ty Cổ phần One Capital Hospitality,Khách sạn và Dịch vụ OCH,
ODE.VN,ODE.VN,Công ty cổ phần Tập đoàn Truyền thông và Giải trí ODE,Tập đoàn Truyền thông và Giải trí ODE,
OGC.VN,OGC.VN,Công ty Cổ phần Tập đoàn Đại Dương,Tập đoàn Đại Dương,
OIL.VN,OIL.VN,Tổng Công ty Dầu Việt Nam - Công ty Cổ phần,PV Oil,
ONE.VN,ONE.VN,Công ty Cổ phần Công nghệ ONE,Truyền thông Số 1,
ONW.VN,ONW.VN,Công ty Cổ phần Dịch vụ Một Thế giới,Dịch vụ Một Thế giới,
OPC.VN,OPC.VN,Công ty Cổ phần Dược Phẩm OPC,Dược phẩm OPC,
ORS.VN,ORS.VN,Công ty Cổ phần Chứng khoán Tiên Phong,Chứng khoán Tiên Phong,
