ts_code,symbol,name,enname,aliases
DCF.VN,DCF.VN,Công ty Cổ phần Xây dựng và Thiết kế số 1,XD và Thiết kế số 1,
DCG.VN,DCG.VN,Công ty Cổ phần Tổng Công ty May Đáp Cầu,May Đáp Cầu,
DCH.VN,DCH.VN,Công ty Cổ phần Địa chính Hà Nội,Địa chính Hà Nội,
DCL.VN,DCL.VN,Công ty Cổ phần Dược phẩm Cửu Long,Dược phẩm Cửu Long,
DCM.VN,DCM.VN,Công ty Cổ phần - Tổng Công ty Phân bón Dầu Khí Cà Mau,Đạm Cà Mau,
DCR.VN,DCR.VN,Công ty Cổ phần Gạch men COSEVCO,Gạch men COSEVCO,
DCS.VN,DCS.VN,Công ty Cổ phần Tập đoàn EDX,Tập đoàn EDX,
DCT.VN,DCT.VN,Công ty Cổ phần Tấm lợp Vật liệu Xây dựng Đồng Nai,Tấm lợp VLXD Đồng Nai,
DCV.VN,DCV.VN,Công ty Cổ phần Quản Lý Quỹ đầu tư Dragon Capital Việt Nam,Quản Lý Quỹ Dragon Capital Việt Nam,
DDB.VN,DDB.VN,Công ty Cổ Phần Thương Mại Và Xây Dựng Đông Dương,TM & XD Đông Dương,
DDH.VN,DDH.VN,Công ty Cổ phần Đảm bảo giao thông đường thủy Hải Phòng,Đảm bảo GTĐT Hải Phòng,
DDM.VN,DDM.VN,Công ty Cổ phần Hàng hải Đông Đô,Hàng hải Đông Đô,
DDN.VN,DDN.VN,Công ty Cổ phần Dược - Thiết bị y tế Đà Nẵng,Dược - TB Y tế Đà Nẵng,
DDV.VN,DDV.VN,Công ty Cổ phần DAP - Vinachem,DAP - Vinachem,
DFC.VN,DFC.VN,Công ty Cổ phần Xích líp Đông Anh,Xích líp Đông Anh,
DFF.VN,DFF.VN,Công ty Cổ phần Tập đoàn Đua Fat,Tập đoàn Đua Fat,
DGC.VN,DGC.VN,Công ty Cổ phần Tập đoàn Hóa chất Đức Giang,Hóa chất Đức Giang,Duc Giang
DGT.VN,DGT.VN,Công ty Cổ phần Công trình Giao thông Đồng Nai,Công trình GT Đồng Nai,
DGW.VN,DGW.VN,Công ty Cổ phần Thế Giới Số,Thế Giới Số,
DHA.VN,DHA.VN,Công ty Cổ phần Hóa An,Hóa An,
DHB.VN,DHB.VN,Công ty Cổ phần Phân đạm và Hóa chất Hà Bắc,Đạm Hà Bắc,
DHC.VN,DHC.VN,Công ty Cổ phần Đông Hải Bến Tre,Đông Hải Bến Tre,
DHD.VN,DHD.VN,Công ty Cổ phần Dược Vật Tư Y Tế Hải Dương,Dược Vật Tư Y Tế Hải Dương,
DHG.VN,DHG.VN,Công ty Cổ phần Dược Hậu Giang,Dược Hậu Giang,
DHM.VN,DHM.VN,Công ty Cổ phần Thương mại & Khai thác Khoáng sản Dương Hiếu,Khoáng sản Dương Hiếu,
DHN.VN,DHN.VN,Công ty Cổ phần Dược phẩm Hà Nội,Dược Hà Nội,
DHP.VN,DHP.VN,Công ty Cổ phần Điện cơ Hải Phòng,Điện cơ Hải Phòng,
DHT.VN,DHT.VN,Công ty Cổ phần Dược phẩm Hà Tây,Dược phẩm Hà Tây,
DIC.VN,DIC.VN,Công ty Cổ phần Đầu tư và Thương mại DIC,ĐT và TM DIC,
DID.VN,DID.VN,Công ty Cổ phần DIC - Đồng Tiến,DIC - Đồng Tiến,
DIG.VN,DIG.VN,Tổng Công ty Cổ phần Đầu tư Phát triển Xây dựng,DIC Corp,
DIH.VN,DIH.VN,Công ty Cổ phần Đầu tư Phát triển Xây dựng - Hội An,PT Xây dựng Hội An,
DKC.VN,DKC.VN,Công ty Cổ phần Chợ Lạng Sơn,Chợ Lạng Sơn,
DKG.VN,DKG.VN,Công ty Cổ Phần Tập đoàn DamiK,Tập đoàn DamiK,
DL1.VN,DL1.VN,Công ty Cổ phần Tập đoàn Alpha Seven,Tập đoàn Alpha 7,
DLD.VN,DLD.VN,Công ty Cổ phần Du lịch Đắk Lắk,Du lịch Đắk Lắk,
DLG.VN,DLG.VN,Công ty Cổ phần Tập đoàn Đức Long Gia Lai,Đức Long Gia Lai,
DLR.VN,DLR.VN,Công ty Cổ phần Địa ốc Đà Lạt,Địa ốc Đà Lạt,
DLT.VN,DLT.VN,Công ty Cổ phần Du lịch và Thương mại - Vinacomin,Du lịch và TM - Vinacomin,
DM7.VN,DM7.VN,Công ty Cổ phần Dệt may 7,Dệt may 7,
DMC.VN,DMC.VN,Công ty Cổ phần Xuất nhập khẩu Y tế DOMESCO,Dược phẩm DOMESCO,
DMN.VN,DMN.VN,Công ty Cổ phần Domenal,Domenal,
DNA.VN,DNA.VN,Công ty Cổ phần Điện nước An Giang,Điện nước An Giang,
DNC.VN,DNC.VN,Công ty Cổ phần Điện nước Lắp máy Hải Phòng,Điện nước Hải Phòng,
DND.VN,DND.VN,Công ty Cổ phần Đầu tư Xây dựng và Vật liệu Đồng Nai,XD và Vật liệu Đồng Nai,
DNE.VN,DNE.VN,Công ty Cổ phần Môi trường Đô thị Đà Nẵng,Môi trường Đô thị Đà Nẵng,
DNH.VN,DNH.VN,Công ty Cổ phần Thủy điện Đa Nhim - Hàm Thuận - Đa Mi,Thủy điện Đa Nhim-Hàm Thuận-Đa Mi,
DNL.VN,DNL.VN,Công ty Cổ phần Logistics Cảng Đà Nẵng,Logistics Cảng Đà Nẵng,
DNM.VN,DNM.VN,Tổng Công ty Cổ phần Y tế Danameco,Y tế Danameco,
DNN.VN,DNN.VN,Công ty Cổ phần Cấp nước Đà Nẵng,Cấp nước Đà Nẵng,
DNP.VN,DNP.VN,Công ty Cổ phần DNP Holding,DNP Holding,
DNT.VN,DNT.VN,Công ty Cổ phần Du lịch Đồng Nai,Du lịch Đồng Nai,
DNW.VN,DNW.VN,Công ty Cổ phần Cấp nước Đồng Nai,Cấp nước Đồng Nai,
DOC.VN,DOC.VN,Công ty Cổ phần Vật tư nông nghiệp Đồng Nai,Vật tư nông nghiệp Đồng Nai,
DOP.VN,DOP.VN,Công ty Cổ phần Vận tải Xăng dầu Đồng Tháp,Vận tải XD Đồng Tháp,
DP1.VN,DP1.VN,Công ty Cổ phần Dược phẩm Trung ương CPC1,Dược phẩm Trung ương CPC1,
DP2.VN,DP2.VN,Công ty Cổ phần Dược phẩm Trung ương 2,Dược phẩm TW 2,
DP3.VN,DP3.VN,Công ty Cổ Phần Dược Phẩm Trung Ương 3,Dược Phẩm TW3,
DPC.VN,DPC.VN,Công ty Cổ phần Nhựa Đà Nẵng,Nhựa Đà Nẵng,
DPG.VN,DPG.VN,Công ty Cổ phần Tập đoàn Đạt Phương,Tập đoàn Đạt Phương,
DPH.VN,DPH.VN,Công ty Cổ phần Dược phẩm Hải Phòng,Dược phẩm Hải Phòng,
DPM.VN,DPM.VN,Tổng Công ty Phân bón và Hóa chất Dầu khí - Công ty Cổ phần,Tổng Công ty Phân bón và Hóa chất Dầu khí,
DPP.VN,DPP.VN,Công ty Cổ phần Dược Đồng Nai,Dược Đồng Nai,
DPR.VN,DPR.VN,Công ty Cổ phần Cao su Đồng Phú,Cao su Đồng Phú,
DQC.VN,DQC.VN,Công ty Cổ phần Tập đoàn Điện Quang,Tập đoàn Điện Quang,
DRC.VN,DRC.VN,Công ty Cổ phần Cao su Đà Nẵng,Cao su Đà Nẵng,
DRG.VN,DRG.VN,Công ty Cổ phần Cao su Đắk Lắk,Cao su Đắk Lắk,
DRH.VN,DRH.VN,Công ty Cổ phần DRH Holdings,DRH Holdings,
DRI.VN,DRI.VN,Công ty Cổ phần Đầu tư Cao su Đắk Lắk,Đầu tư Cao su Đắk Lắk,
DRL.VN,DRL.VN,Công ty Cổ phần Thủy điện - Điện lực 3,Thủy điện - Điện lực 3,
DS3.VN,DS3.VN,Công ty Cổ phần DS3,Quản lý Đường sông số 3,
DSC.VN,DSC.VN,Công ty Cổ phần Chứng khoán DSC,Chứng khoán DSC,
DSD.VN,DSD.VN,Công ty cổ phần DHC Suối Đôi,DHC Suối Đôi,
DSE.VN,DSE.VN,Công ty Cổ phần Chứng khoán DNSE,Chứng Khoán DNSE,
DSG.VN,DSG.VN,Công ty Cổ phần Kính Đáp Cầu,Kính Đáp Cầu,
DSH.VN,DSH.VN,Công ty Cổ Phần Đầu tư Hạ tầng Đông Sơn,ĐT Hạ tầng Đông Sơn,
DSN.VN,DSN.VN,Công ty Cổ phần Công viên nước Đầm Sen,Công viên nước Đầm Sen,
DSP.VN,DSP.VN,Công ty Cổ phần Dịch vụ Du lịch Phú Thọ,Dịch vụ Du lịch Phú Thọ,
DST.VN,DST.VN,Công ty Cổ phần Đầu tư Sao Thăng Long,Đầu tư Sao Thăng Long,
DTA.VN,DTA.VN,Công ty Cổ phần Đệ Tam,BĐS Đệ Tam,
DTC.VN,DTC.VN,Công ty Cổ phần Viglacera Đông Triều,Viglacera Đông Triều,
DTD.VN,DTD.VN,Công ty Cổ phần Đầu tư Phát triển Thành Đạt,Đầu tư Phát triển Thành Đạt,
DTG.VN,DTG.VN,Công ty Cổ phần Dược phẩm Tipharco,Dược phẩm Tipharco,
DTH.VN,DTH.VN,Công ty Cổ phần Dược - Vật tư Y tế Thanh Hóa,Vật tư Y tế Thanh Hóa,
DTI.VN,DTI.VN,Công ty Cổ phần Đầu tư Đức Trung,Đầu tư Đức Trung,
DTK.VN,DTK.VN,Tổng Công ty Điện lực TKV - Công ty Cổ phần,Vinacomin Power,
DTL.VN,DTL.VN,Công ty Cổ phần Đại Thiên Lộc,Đại Thiên Lộc,
DTP.VN,DTP.VN,Công ty Cổ phần Dược phẩm CPC1 Hà Nội,Dược phẩm CPC1 Hà Nội,
DTT.VN,DTT.VN,Công ty Cổ phần Kỹ nghệ Đô Thành,Kỹ nghệ Đô Thành,
DUS.VN,DUS.VN,Công ty Cổ phần Dịch vụ Đô thị Đà Lạt,Dịch vụ Đô thị Đà Lạt,
DVC.VN,DVC.VN,Công ty Cổ phần Thương mại dịch vụ Tổng Hợp Cảng Hải Phòng,TM dịch vụ Cảng Hải Phòng,
DVG.VN,DVG.VN,Công ty Cổ phần Đại Việt Group DVG,Tập đoàn Sơn Đại Việt,
DVM.VN,DVM.VN,Công ty Cổ phần Dược liệu Việt Nam,Dược liệu Việt Nam,
DVN.VN,DVN.VN,Tổng Công ty Dược Việt Nam - CTCP,Tổng Công ty Dược Việt Nam,
DVP.VN,DVP.VN,Công ty Cổ phần Đầu tư và Phát triển Cảng Đình Vũ,ĐT và PT Cảng Đình Vũ,
DVT.VN,DVT.VN,Công ty Cổ phần Đào tạo và Dịch vụ Giao thông vận tải Bình Định,ĐT & DV GTVT Bình Định,
DVW.VN,DVW.VN,Công ty Cổ phần Dịch vụ và Xây dựng cấp nước Đồng Nai,DV và XD cấp nước Đồng Nai,
DWC.VN,DWC.VN,Công ty Cổ phần Cấp nước Đắk Lắk,Cấp nước Đắk Lắk,
DWS.VN,DWS.VN,Công ty Cổ phần Cấp nước và Môi trường Đô thị Đồng Tháp,Cấp nước Đồng Tháp,
DXG.VN,DXG.VN,Công ty Cổ phần Tập đoàn Đất Xanh,Địa ốc Đất Xanh,
DXL.VN,DXL.VN,Công ty Cổ phần Du lịch và Xuất nhập khẩu Lạng Sơn,Du lịch và Xuất nhập khẩu Lạng Sơn,
DXP.VN,DXP.VN,Công ty Cổ phần Cảng Đoạn Xá,Cảng Đoạn Xá,
DXS.VN,DXS.VN,Công ty Cổ phần Dịch vụ Bất động sản Đất Xanh,Dịch vụ BĐS Đất Xanh,
DXV.VN,DXV.VN,Công ty Cổ phần VICEM Vật liệu Xây dựng Đà Nẵng,Vật liệu Xây dựng Đà Nẵng,
DZM.VN,DZM.VN,Công ty Cổ phần Cơ điện Dzĩ An,Cơ điện Dzĩ An,
E12.VN,E12.VN,Công ty Cổ phần Xây Dựng Điện VNECO 12,XD Điện VNECO 12,
E29.VN,E29.VN,Công ty cổ phần Đầu tư Xây dựng và Kỹ thuật 29,Đầu tư XD và Kỹ thuật 29,
EBS.VN,EBS.VN,Công ty Cổ phần Sách Giáo dục tại Thành phố Hà Nội,Sách Giáo dục Hà Nội,
ECI.VN,ECI.VN,Công ty Cổ phần Tập đoàn ECI,Bản đồ và tranh ảnh GD,
ECO.VN,ECO.VN,Công ty Cổ Phần Nhựa Sinh Thái Việt Nam,Ecoplastic VN,
EFI.VN,EFI.VN,Công ty Cổ phần Đầu tư Tài chính Giáo dục,Tài chính giáo dục,
EGL.VN,EGL.VN,Công ty Cổ phần Môi Trường Đô Thị Gia Lâm,"Urenco Gia Lam.,Jsc",
EIB.VN,EIB.VN,Ngân hàng Thương mại Cổ phần Xuất nhập khẩu Việt Nam,Eximbank,
EIC.VN,EIC.VN,Công ty Cổ phần EVN Quốc Tế,EVN Quốc Tế,
EID.VN,EID.VN,Công ty Cổ phần Đầu tư và Phát triển Giáo dục Hà Nội,Phát triển GD Hà Nội,
EIN.VN,EIN.VN,Công ty Cổ phần Đầu tư - Thương Mại - Dịch vụ Điện lực,Đầu tư - TM - DV Điện lực,
ELC.VN,ELC.VN,Công ty Cổ phần Công nghệ - Viễn thông ELCOM,ELCOM,
EME.VN,EME.VN,Công ty Cổ phần Điện Cơ,Điện Cơ,
EMG.VN,EMG.VN,Công ty Cổ phần Thiết bị Phụ tùng Cơ điện,Thiết bị phụ tùng cơ điện,
EMS.VN,EMS.VN,Tổng Công ty Chuyển phát nhanh Bưu điện - Công ty Cổ phần,Chuyển phát nhanh Bưu điện,
EVE.VN,EVE.VN,Công ty Cổ phần Everpia,Everpia,
EVF.VN,EVF.VN,Công ty Tài chính Tổng hợp Cổ phần Điện Lực,Tài chính Tổng hợp Điện lực,
EVG.VN,EVG.VN,Công ty Cổ phần Tập đoàn Everland,Tập đoàn Everland,
EVS.VN,EVS.VN,Công ty Cổ phần Chứng khoán EVS,Chứng khoán EVS,
F88.VN,F88.VN,Công ty Cổ phần Đầu tư F88,Đầu tư F88,
FBC.VN,FBC.VN,Công ty Cổ phần Cơ khí Phổ Yên,Cơ khí Phổ Yên,
FCC.VN,FCC.VN,Công ty Cổ phần Liên hợp Thực phẩm,Liên hợp Thực phẩm,
FCM.VN,FCM.VN,Công ty Cổ phần Bê tông Phan Vũ Hà Nam,Bê tông Phan Vũ Hà Nam,
FCN.VN,FCN.VN,Công ty Cổ phần FECON,FECON CORP,
FCS.VN,FCS.VN,Công ty Cổ phần Lương thực Thành phố Hồ Chí Minh,Lương thực TP Hồ Chí Minh,
FDC.VN,FDC.VN,Công ty Cổ phần Ngoại thương và Phát triển Đầu tư Thành phố Hồ Chí Minh,FIDECO,
FGL.VN,FGL.VN,Công ty Cổ phần Cà phê Gia Lai,Cà Phê Gia Lai,
FHN.VN,FHN.VN,Công ty Cổ phần Xuất nhập khẩu Lương thực - Thực phẩm Hà Nội,XNK lương thực Hà Nội,
FHS.VN,FHS.VN,Công ty Cổ phần Phát hành sách Thành phố Hồ Chí Minh - FAHASA,Phát hành sách TP HCM - FAHASA,
FIC.VN,FIC.VN,Tổng Công ty Vật liệu Xây dựng số 1 - Công ty Cổ phần,VLXD số 1,
FID.VN,FID.VN,Công ty Cổ phần Đầu tư và Phát triển Doanh nghiệp Việt Nam,Đầu tư và PT doanh nghiệp VN,
FIR.VN,FIR.VN,Công ty Cổ phần Địa ốc First Real,Địa ốc First Real,
FIT.VN,FIT.VN,Công ty Cổ phần Tập đoàn F.I.T,Tập đoàn F.I.T,
FMC.VN,FMC.VN,Công ty Cổ phần Thực phẩm Sao Ta,Thực phẩm Sao Ta,
FOC.VN,FOC.VN,Công ty Cổ phần Dịch vụ Trực tuyến FPT,FPT Online,
FOX.VN,FOX.VN,Công ty Cổ phần Viễn thông FPT,FPT Telecom,
FPT.VN,FPT.VN,Công ty Cổ phần FPT,FPT Corp,FPT Corp
FRC.VN,FRC.VN,Công ty Cổ phần Lâm đặc sản xuất khẩu Quảng Nam,Lâm đặc sản xuất khẩu Quảng Nam,
FRM.VN,FRM.VN,Công ty Cổ phần Lâm nghiệp Sài Gòn,Lâm nghiệp Sài Gòn,
FRT.VN,FRT.VN,Công ty Cổ phần Bán lẻ Kỹ thuật số FPT,Bán lẻ FPT,
FSO.VN,FSO.VN,Công ty Cổ phần Cơ khí đóng tàu thủy sản Việt Nam,Đóng tàu thủy sản VN,
FT1.VN,FT1.VN,Công ty Cổ phần Phụ tùng máy số 1,Phụ tùng máy số 1,
FTI.VN,FTI.VN,Công ty Cổ phần Công nghiệp - Thương mại Hữu Nghị,Công nghiệp - Thương mại Hữu Nghị,
FTM.VN,FTM.VN,Công ty Cổ phần Đầu tư và Phát triển Đức Quân,Phát triển Đức Quân,
FTS.VN,FTS.VN,Công ty Cổ phần Chứng khoán FPT,Chứng khoán FPT,
G20.VN,G20.VN,Công ty Cổ phần Đầu tư Dệt may Vĩnh Phúc,Đầu tư Dệt may Vĩnh Phúc,
G36.VN,G36.VN,Tổng Công ty 36 - Công ty Cổ phần,Tổng Công ty 36,
GAS.VN,GAS.VN,Tổng Công ty Khí Việt Nam - Công ty Cổ phần,PV Gas,PV Gas|PetroVietnam Gas
GCB.VN,GCB.VN,Công ty Cổ phần PETEC Bình Định,PETEC Bình Định,
GCF.VN,GCF.VN,Công ty Cổ phần Thực phẩm G.C,Thực phẩm G.C,
GDA.VN,GDA.VN,Công ty Cổ phần Tôn Đông Á,Tôn Đông Á,
GDH.VN,GDH.VN,Cổ phiếu Công ty cổ phần Tập đoàn GDC,Cổ phiếu Công ty cổ phần Tập đoàn GDC,
GDT.VN,GDT.VN,Công ty Cổ phần Chế biến Gỗ Đức Thành,Gỗ Đức Thành,
GDW.VN,GDW.VN,Công ty Cổ phần Cấp nước Gia Định,Cấp nước Gia Định,
GEE.VN,GEE.VN,Công ty Cổ phần Điện lực Gelex,Thiết bị điện GELEX,
GEG.VN,GEG.VN,Công ty Cổ phần Điện Gia Lai,Điện Gia Lai,
GEL.VN,GEL.VN,Công ty Cổ phần Hạ tầng GELEX,Hạ tầng GELEX,
GER.VN,GER.VN,Công ty Cổ phần Thể thao Ngôi sao Geru,Thể thao Ngôi sao Geru,
GEX.VN,GEX.VN,Công ty Cổ phần Tập đoàn Gelex,Tập đoàn Gelex,
GGG.VN,GGG.VN,Công ty Cổ phần Ô tô Giải Phóng,Ôtô Giải Phóng,
GH3.VN,GH3.VN,Công ty Cổ phần Công trình giao thông Hà Nội,Công trình giao thông Hà Nội,
GHC.VN,GHC.VN,Công ty Cổ phần Thủy điện Gia Lai,Thủy điện Gia Lai,
GIC.VN,GIC.VN,Công ty Cổ phần VSC Green Logistics,ĐT Dịch vụ và PT Xanh,
GIL.VN,GIL.VN,Công ty Cổ phần Sản xuất Kinh doanh Xuất nhập khẩu Bình Thạnh,XNK Bình Thạnh,
GKM.VN,GKM.VN,Công ty Cổ phần GKM Holdings,GKM Holdings,
GLC.VN,GLC.VN,Công ty Cổ phần Vàng Lào Cai,Vàng Lào Cai,
GLT.VN,GLT.VN,Công ty Cổ phần Kỹ thuật điện Toàn Cầu,KT Điện Toàn Cầu,
GLW.VN,GLW.VN,Công ty Cổ phần Cấp thoát nước Gia Lai,Cấp thoát nước Gia Lai,
GMA.VN,GMA.VN,Công ty Cổ phần G-Automobile,G-Automobile,
GMC.VN,GMC.VN,Công ty Cổ phần Garmex Sài Gòn,Garmex Sài Gòn,
GMD.VN,GMD.VN,Công ty Cổ phần Gemadept,Gemadept,
GMH.VN,GMH.VN,Công ty Cổ phần Minh Hưng Quảng Trị,Minh Hưng Quảng Trị,
GMX.VN,GMX.VN,Công ty Cổ phần Gạch ngói Gốm xây dựng Mỹ Xuân,Gạch ngói Mỹ Xuân,
GND.VN,GND.VN,Công ty Cổ phần Gạch ngói Đồng Nai,Gạch ngói Đồng Nai,
GPC.VN,GPC.VN,Công ty Cổ phần Tập đoàn Green+,Tập đoàn Green+,
GSM.VN,GSM.VN,Công ty Cổ phần Thủy điện Hương Sơn,Thủy điện Hương Sơn,
GSP.VN,GSP.VN,Công ty Cổ phần Vận tải Sản phẩm Khí Quốc tế,Vận tải Sản phẩm Khí Quốc tế,
GTA.VN,GTA.VN,Công ty Cổ phần Chế biến Gỗ Thuận An,Gỗ Thuận An,
GTD.VN,GTD.VN,Công ty Cổ phần Giầy Thượng Đình,Giầy Thượng Đình,
GTS.VN,GTS.VN,Công ty Cổ phần Công trình Giao thông Sài Gòn,Công trình Giao thông Sài Gòn,
GTT.VN,GTT.VN,Công ty Cổ phần Thuận Thảo,Thuận Thảo Group,
GVR.VN,GVR.VN,Tập đoàn Công nghiệp Cao su Việt Nam - Công ty Cổ phần,Tập đoàn CN Cao su VN,Rubber Group
GVT.VN,GVT.VN,Công ty Cổ phần Giấy Việt Trì,Giấy Việt Trì,
H11.VN,H11.VN,Công ty Cổ phần Xây dựng HUD101,Xây dựng HUD101,
HAC.VN,HAC.VN,Công ty Cổ phần Chứng khoán Hải Phòng,Chứng khoán Hải Phòng,
HAD.VN,HAD.VN,Công ty Cổ phần Bia Hà Nội - Hải Dương,Bia Hà Nội - Hải Dương,
HAF.VN,HAF.VN,Công ty Cổ phần Thực phẩm Hà Nội,Thực phẩm Hà Nội,
HAG.VN,HAG.VN,Công ty Cổ phần Hoàng Anh Gia Lai,Hoàng Anh Gia Lai,
HAH.VN,HAH.VN,Công ty Cổ phần Vận tải và Xếp dỡ Hải An,Vận tải và Xếp dỡ Hải An,
HAM.VN,HAM.VN,Công ty Cổ phần Vật tư Hậu Giang,Vật tư Hậu Giang,
HAN.VN,HAN.VN,Tổng Công ty Xây dựng Hà Nội - CTCP,Xây dựng Hà Nội,
HAP.VN,HAP.VN,Công ty Cổ phần Tập Đoàn Hapaco,Tập đoàn Hapaco,
HAR.VN,HAR.VN,Công ty Cổ phần Đầu tư Thương mại Bất động sản An Dương Thảo Điền,BĐS An Dương Thảo Điền,
HAS.VN,HAS.VN,Công ty Cổ phần Hacisco,Hacisco,
HAT.VN,HAT.VN,Công ty Cổ phần Thương mại Bia Hà Nội,TM Bia Hà Nội,
HAV.VN,HAV.VN,Công ty Cổ phần Rượu Hapro,Rượu Hapro,
HAX.VN,HAX.VN,Công ty Cổ phần Dịch vụ Ô tô Hàng Xanh,Ô tô Hàng Xanh,
HBC.VN,HBC.VN,Công ty Cổ phần Tập đoàn Xây dựng Hòa Bình,Tập đoàn Xây dựng Hòa Bình,
HBD.VN,HBD.VN,Công ty Cổ phần Bao bì PP Bình Dương,Bao bì PP Bình Dương,
HBH.VN,HBH.VN,Công ty Cổ phần HABECO - Hải Phòng,HABECO Hải Phòng,
HBS.VN,HBS.VN,Công ty Cổ phần Chứng khoán Hòa Bình,Chứng khoán Hòa Bình,
HC1.VN,HC1.VN,Công ty Cổ phần Xây dựng số 1 Hà Nội,Xây dựng số 1 Hà Nội,
HC3.VN,HC3.VN,Công ty Cổ phần Xây dựng số 3 Hải Phòng,Xây dựng số 3 Hải Phòng,
HCC.VN,HCC.VN,Công ty Cổ phần Bê tông Hòa Cầm - Intimex,Bê tông Hòa Cầm,
HCD.VN,HCD.VN,Công ty Cổ phần Đầu tư Sản xuất và Thương mại HCD,SX và Thương mại HCD,
HCI.VN,HCI.VN,Công ty Cổ phần Đầu tư - Xây dựng Hà Nội,Đầu tư - XD Hà Nội,
HCM.VN,HCM.VN,Công ty Cổ phần Chứng khoán Thành phố Hồ Chí Minh,Chứng khoán HSC,
HCT.VN,HCT.VN,Công ty Cổ phần Thương mại - Dịch vụ - Vận tải Xi măng Hải Phòng,TM - DV - Vận tải Xi măng Hải Phòng,
HD2.VN,HD2.VN,Công ty Cổ phần Đầu tư phát triển nhà HUD2,Đầu tư phát triển nhà HUD 2,
HD6.VN,HD6.VN,Công ty Cổ phần Đầu tư và Phát triển nhà số 6 Hà Nội,Phát triển nhà số 6 Hà Nội,
HD8.VN,HD8.VN,Công ty Cổ phần Đầu tư Phát triển Nhà và Đô thị HUD8,PT Nhà và Đô thị HUD8,
HDA.VN,HDA.VN,Công ty Cổ phần Hãng sơn Đông Á,Hãng sơn Đông Á,
HDB.VN,HDB.VN,Ngân hàng Thương mại Cổ phần Phát Triển Thành phố Hồ Chí Minh,HDBank,HDBank
HDC.VN,HDC.VN,Công ty Cổ phần Phát triển Nhà Bà Rịa Vũng Tàu,Phát triển Nhà BR-VT,
HDG.VN,HDG.VN,Công ty Cổ phần Tập đoàn Hà Đô,Tập đoàn Hà Đô,
HDM.VN,HDM.VN,Công ty Cổ phần Dệt May Huế,Dệt May Huế,
HDP.VN,HDP.VN,Công ty Cổ phần Dược Hà Tĩnh,Dược Hà Tĩnh,
HDW.VN,HDW.VN,Công ty Cổ phần Kinh doanh Nước sạch Hải Dương,Nước sạch Hải Dương,
HEC.VN,HEC.VN,Công ty Cổ phần Tư vấn xây dựng Thủy Lợi II,Tư vấn XD Thủy Lợi II (HEC II),
HEJ.VN,HEJ.VN,Tổng Công ty Tư vấn Xây dựng Thủy Lợi Việt Nam - CTCP,Tư vấn Xây dựng Thủy Lợi VN,
HEP.VN,HEP.VN,Công ty Cổ phần Môi trường và Công trình đô thị Huế,Môi trường và Công trình đô thị Huế,
HES.VN,HES.VN,Công ty Cổ phần Dịch vụ Giải trí Hà Nội,Dịch vụ Giải trí Hà Nội,
HEV.VN,HEV.VN,Công ty Cổ phần Sách Đại học - Dạy nghề,Sách Đại học - Dạy nghề,
HFB.VN,HFB.VN,Công ty Cổ phần Công trình Cầu phà Thành phố Hồ Chí Minh,Công trình Cầu phà TP HCM,
HFC.VN,HFC.VN,Công ty Cổ phần Xăng dầu HFC,Xăng dầu HFC,
HFX.VN,HFX.VN,Công ty Cổ phần Sản xuất - Xuất nhập khẩu Thanh Hà,XNK Thanh Hà,
HGM.VN,HGM.VN,Công ty Cổ phần Cơ khí và Khoáng sản Hà Giang,Khoáng sản Hà Giang,
HGT.VN,HGT.VN,Công ty Cổ phần Du lịch Hương Giang,Du lịch Hương Giang,
HHB.VN,HHB.VN,Công ty Cổ Phần Bia Hà Nội - Hồng Hà,Bia Hà Nội - Hồng Hà,
HHC.VN,HHC.VN,Công ty Cổ phần Bánh kẹo Hải Hà,Bánh kẹo Hải Hà,
HHG.VN,HHG.VN,Công ty Cổ phần Hoàng Hà,Vận tải Hoàng Hà,
HHN.VN,HHN.VN,Công ty Cổ phần Vận tải và Dịch vụ Hàng hóa Hà Nội,Vận tải và DV Hàng hóa Hà Nội,
HHP.VN,HHP.VN,Công ty Cổ phần HHP Global,HHP Global,
HHS.VN,HHS.VN,Công ty Cổ phần Đầu tư Dịch vụ Hoàng Huy,Đầu tư DV Hoàng Huy,
HHV.VN,HHV.VN,Công ty Cổ phần Đầu tư Hạ tầng Giao thông Đèo Cả,Đầu tư Hạ tầng Giao thông Đèo Cả,
HID.VN,HID.VN,Công ty Cổ phần Halcom Vietnam,Halcom Vietnam,
HII.VN,HII.VN,Công ty Cổ phần An Tiến Industries,An Tiến Industries,
HIO.VN,HIO.VN,Công ty Cổ Phần Helio Energy,Helio Energy,
HJC.VN,HJC.VN,Công ty Cổ phần Hoà Việt,Công ty Cổ phần Hoà Việt,
HJS.VN,HJS.VN,Công ty Cổ phần Thủy điện Nậm Mu,Thủy điện Nậm Mu,
HKB.VN,HKB.VN,Công ty Cổ phần Nông nghiệp và Thực phẩm Hà Nội - Kinh Bắc,Thực phẩm Hà Nội - Kinh Bắc,
HKT.VN,HKT.VN,Công ty Cổ phần Đầu tư QP Xanh,Đầu tư QP Xanh,
HLA.VN,HLA.VN,Công ty Cổ phần Hữu Liên Á Châu,Hữu Liên Á Châu,
HLB.VN,HLB.VN,Công ty Cổ phần Bia và Nước giải khát Hạ Long,Bia và NGK Hạ Long,
HLC.VN,HLC.VN,Công ty Cổ phần Than Hà Lầm - Vinacomin,Than Hà Lầm,
HLD.VN,HLD.VN,Công ty Cổ phần Đầu tư và Phát triển Bất động sản HUDLAND,Bất động sản HUDLAND,
HLO.VN,HLO.VN,Công Ty Cổ Phần Công Nghệ Ha Lô,Công Nghệ Ha Lô,
HLS.VN,HLS.VN,Công ty Cổ phần Sứ kỹ thuật Hoàng Liên Sơn,Sứ Hoàng Liên Sơn,
HLT.VN,HLT.VN,Công ty Cổ phần Dệt may Hoàng Thị Loan,Dệt may Hoàng Thị Loan,
HLY.VN,HLY.VN,Công ty Cổ phần Gốm xây dựng Yên Hưng,Gốm Xây Dựng Yên Hưng,
HMC.VN,HMC.VN,Công ty Cổ phần Kim khí Thành phố Hồ Chí Minh - VNSTEEL,Kim khí TP.HCM,
HMD.VN,HMD.VN,Công ty Cổ phần Hóa chất Minh Đức,Hóa chất Minh Đức,
HMG.VN,HMG.VN,Công ty Cổ phần Kim Khí Hà Nội - VNSTEEL,Kim Khí Hà Nội,
HMH.VN,HMH.VN,Công ty Cổ phần Hải Minh,Tập đoàn Hải Minh,
HMR.VN,HMR.VN,Công ty Cổ phần Đá Hoàng Mai,Đá Hoàng Mai,
HMS.VN,HMS.VN,Công ty Cổ phần Xây dựng Bảo tàng Hồ Chí Minh,XD Bảo tàng Hồ Chí Minh,
HNA.VN,HNA.VN,Công ty Cổ phần Thủy điện Hủa Na,Thủy điện Hủa Na,
HNB.VN,HNB.VN,Công ty Cổ phần Bến xe Hà Nội,Bến xe Hà Nội,
HND.VN,HND.VN,Công ty Cổ phần Nhiệt điện Hải Phòng,Nhiệt điện Hải Phòng,
HNF.VN,HNF.VN,Công ty Cổ phần Thực phẩm Hữu Nghị,Bánh kẹo Hữu Nghị,
HNG.VN,HNG.VN,Công ty Cổ phần Nông nghiệp Quốc tế Hoàng Anh Gia Lai,Nông nghiệp Quốc tế HAGL,
HNI.VN,HNI.VN,Công ty Cổ phần May Hữu Nghị,May Hữu Nghị,
HNM.VN,HNM.VN,Công ty Cổ phần Sữa Hà Nội,HANOIMILK,
HNP.VN,HNP.VN,Công ty Cổ phần Hanel Xốp Nhựa,Hanel Xốp Nhựa,
HNR.VN,HNR.VN,Công ty Cổ phần Rượu và Nước Giải Khát Hà Nội,Cồn Rượu và Nước Giải Khát Hà Nội,
HOM.VN,HOM.VN,Công ty Cổ phần Xi măng VICEM Hoàng Mai,Xi măng VICEM Hoàng Mai,
HOT.VN,HOT.VN,Công ty Cổ phần Du lịch - Dịch vụ Hội An,Du lịch - DV Hội An,
HPA.VN,HPA.VN,Công ty Cổ phần Phát triển Nông nghiệp Hoà Phát,Phát triển Nông nghiệp Hoà Phát,
HPB.VN,HPB.VN,Công ty Cổ phần Bao bì PP,Bao bì PP,
HPD.VN,HPD.VN,Công ty Cổ phần Thủy điện Đăk Đoa,Thủy điện Đăk Đoa,
HPG.VN,HPG.VN,Công ty Cổ phần Tập đoàn Hòa Phát,Hòa Phát,Hoa Phat|Hòa Phát
HPH.VN,HPH.VN,Công ty Cổ phần Hóa Chất Hưng Phát Hà Bắc,Hóa Chất Hưng Phát Hà Bắc,
HPI.VN,HPI.VN,Công ty Cổ phần Khu công nghiệp Hiệp Phước,Khu công nghiệp Hiệp Phước,
HPO.VN,HPO.VN,Công ty Cổ phần Công nghiệp Hapulico,Công nghiệp Hapulico,
HPP.VN,HPP.VN,Công ty Cổ phần Sơn Hải Phòng,Sơn Hải Phòng,
HPT.VN,HPT.VN,Công ty Cổ phần Dịch vụ Công nghệ Tin học HPT,DV Công nghệ Tin học HPT,
HPW.VN,HPW.VN,Công ty Cổ phần Cấp nước Hải Phòng,Cấp nước Hải Phòng,
HPX.VN,HPX.VN,Công ty Cổ phần Đầu tư Hải Phát,Đầu tư Hải Phát,
HQC.VN,HQC.VN,Công ty Cổ phần Tư vấn - Thương mại - Dịch vụ Địa ốc Hoàng Quân,Địa ốc Hoàng Quân,
HRB.VN,HRB.VN,Công ty Cổ phần Harec Đầu tư và Thương Mại,Harec Đầu tư và Thương Mại,
