ts_code,symbol,name,enname,aliases
SPV.VN,SPV.VN,Công ty Cổ phần Thủy Đặc Sản,Thủy đặc sản,
SRA.VN,SRA.VN,Công ty Cổ phần SARA Việt Nam,SARA Việt Nam,
SRB.VN,SRB.VN,Công ty Cổ phần Tập đoàn Sara,SARA,
SRC.VN,SRC.VN,Công ty Cổ phần Cao su Sao Vàng,Cao su Sao Vàng,
SRF.VN,SRF.VN,Công ty Cổ phần Searefico,SEAREFICO,
SSB.VN,SSB.VN,Ngân hàng Thương mại Cổ phần Đông Nam Á,SeABank,
SSC.VN,SSC.VN,Công ty Cổ phần Giống cây trồng Miền Nam,Giống cây trồng Miền Nam,
SSF.VN,SSF.VN,Công ty Cổ phần Giáo dục G Sài Gòn,Giáo dục G Sài Gòn,
SSG.VN,SSG.VN,Công ty Cổ phần Vận tải Biển Hải Âu,Vận tải Biển Hải Âu,
SSH.VN,SSH.VN,Công ty Cổ phần Phát triển Sunshine Homes,Phát triển Sunshine Homes,
SSI.VN,SSI.VN,Công ty Cổ phần Chứng khoán SSI,Chứng khoán SSI,SSI Securities
SSM.VN,SSM.VN,Công ty Cổ phần Chế tạo kết cấu thép VNECO.SSM,Kết cấu Thép VNECO,
SSN.VN,SSN.VN,Công ty Cổ phần Xuất nhập khẩu Thủy sản Sài Gòn,Thủy sản Sài Gòn,
ST8.VN,ST8.VN,Công ty Cổ phần Tập đoàn ST8,Tập đoàn ST8,
STB.VN,STB.VN,Ngân hàng Thương mại Cổ phần Sài Gòn Thương Tín,Sacombank,Sacombank
STC.VN,STC.VN,Công ty Cổ phần Sách và Thiết bị trường học Thành phố Hồ Chí Minh,Sách và TB Trường học TP HCM,
STD.VN,STD.VN,Công ty Cổ phần Bia - Nước giải khát Sài Gòn - Tây Đô,Bia - NGK Sài Gòn - Tây Đô,
STG.VN,STG.VN,Công ty Cổ phần Kho Vận Miền Nam,Kho Vận Miền Nam,
STH.VN,STH.VN,Công ty Cổ phần STH Holdings,STH Holdings,
STK.VN,STK.VN,Công ty Cổ phần Sợi Thế Kỷ,Sợi Thế Kỷ,
STL.VN,STL.VN,Công ty Cổ phần Sông Đà - Thăng Long,Sông Đà - Thăng Long,
STP.VN,STP.VN,Công ty Cổ phần Công nghiệp Thương mại Sông Đà,CN Thương Mại Sông Đà,
STS.VN,STS.VN,Công ty Cổ phần Dịch vụ vận tải Sài Gòn,Dịch vụ vận tải Sài Gòn,
STT.VN,STT.VN,Công ty Cổ phần Vận chuyển Sài Gòn Tourist,Vận chuyển Sài Gòn Tourist,
STW.VN,STW.VN,Công ty Cổ phần Cấp nước Sóc Trăng,Cấp nước Sóc Trăng,
SVC.VN,SVC.VN,Công ty Cổ phần Dịch vụ tổng hợp Sài Gòn,SAVICO,
SVD.VN,SVD.VN,Công ty Cổ phần Đầu tư & Thương mại Vũ Đăng,Đầu tư & Thương mại Vũ Đăng,
SVG.VN,SVG.VN,Công ty Cổ phần Hơi kỹ nghệ Que hàn,Hơi kỹ nghệ Que hàn,
SVH.VN,SVH.VN,Công ty Cổ phần Thủy điện Sông Vàng,Thủy điện Sông Vàng,
SVN.VN,SVN.VN,Công ty Cổ phần Tập đoàn Vexilla Việt Nam,Tập đoàn Vexilla Việt Nam,
SVT.VN,SVT.VN,Công ty Cổ phần Công nghệ Sài Gòn Viễn Đông,Công nghệ SG Viễn Đông,
SWC.VN,SWC.VN,Tổng Công ty Cổ phần Đường Sông Miền Nam,Đường Sông Miền Nam,
SZB.VN,SZB.VN,Công ty Cổ phần Sonadezi Long Bình,Sonadezi Long Bình,
SZC.VN,SZC.VN,Công ty Cổ phần Sonadezi Châu Đức,Sonadezi Châu Đức,
SZE.VN,SZE.VN,Công ty Cổ phần Môi trường Sonadezi,Môi trường Sonadezi,
SZG.VN,SZG.VN,Công ty Cổ phần Sonadezi Giang Điền,Sonadezi Giang Điền,
SZL.VN,SZL.VN,Công ty Cổ phần Sonadezi Long Thành,Sonadezi Long Thành,
TA6.VN,TA6.VN,Công ty Cổ phần Đầu tư và Xây lắp Thành An 665,Đầu tư và Xây lắp Thành An 665,
TA9.VN,TA9.VN,Công ty Cổ phần Xây lắp Thành An 96,Xây lắp Thành An 96,
TAB.VN,TAB.VN,Công ty Cổ phần Freco Việt Nam,Freco Việt Nam,
TAL.VN,TAL.VN,Công Ty Cổ Phần Đầu Tư Bất Động Sản Taseco,Đầu Tư Bất Động Sản Taseco,
TAN.VN,TAN.VN,Công ty Cổ phần Cà phê Thuận An,Cà phê Thuận An,
TAR.VN,TAR.VN,Công ty Cổ phần Nông nghiệp Công nghệ cao Trung An,Nông nghiệp CN cao Trung An,
TAW.VN,TAW.VN,Công ty Cổ phần Cấp nước Trung An,Cấp nước Trung An,
TBC.VN,TBC.VN,Công ty Cổ phần Thủy điện Thác Bà,Thủy điện Thác Bà,
TBD.VN,TBD.VN,Tổng công ty Thiết bị điện Đông Anh - Công ty Cổ phần,Thiết bị điện Đông Anh,
TBR.VN,TBR.VN,Công ty Cổ phần Địa ốc Tân Bình,Địa ốc Tân Bình,
TBW.VN,TBW.VN,Công ty cổ phần Nước sạch Thái Bình,Nước sạch Thái Bình,
TCB.VN,TCB.VN,Ngân hàng Thương mại Cổ phần Kỹ thương Việt Nam,Techcombank,Techcombank
TCD.VN,TCD.VN,Công ty cổ phần Tập đoàn Xây dựng Tracodi,Tập đoàn Xây dựng Tracodi,
TCH.VN,TCH.VN,Công ty Cổ phần Đầu tư Dịch vụ Tài chính Hoàng Huy,ĐT DV Tài chính Hoàng Huy,
TCI.VN,TCI.VN,Công ty Cổ phần Chứng khoán Thành Công,Chứng khoán Thành Công,
TCJ.VN,TCJ.VN,Công ty Cổ phần Tô Châu,Tô Châu,
TCK.VN,TCK.VN,Tổng Công ty Cơ khí Xây dựng - CTCP,COMA,
TCL.VN,TCL.VN,Công ty Cổ phần Đại lý Giao nhận Vận tải Xếp dỡ Tân Cảng,Tan Cang Logistics,
TCM.VN,TCM.VN,Công ty Cổ phần Dệt may - Đầu tư - Thương mại Thành Công,Dệt may Thành Công,
TCO.VN,TCO.VN,Công ty Cổ phần Janus Group,Janus Group,
TCR.VN,TCR.VN,Công ty Cổ phần Công nghiệp Gốm sứ TAICERA,Gốm sứ TAICERA,
TCT.VN,TCT.VN,Công ty Cổ phần Cáp treo Núi Bà Tây Ninh,Cáp treo Tây Ninh,
TCW.VN,TCW.VN,Công ty Cổ phần Kho Vận Tân Cảng,Kho Vận Tân Cảng,
TCX.VN,TCX.VN,Công ty Cổ phần Chứng khoán Kỹ Thương,Chứng khoán TCBS,
TD6.VN,TD6.VN,Công ty Cổ Phần Than Đèo Nai - Cọc Sáu - TKV,Than Đèo Nai - Cọc Sáu - TKV,
TDB.VN,TDB.VN,Công ty Cổ phần Thủy điện Định Bình,Thủy điện Định Bình,
TDC.VN,TDC.VN,Công ty Cổ phần Kinh doanh và Phát triển Bình Dương,Becamex TDC,
TDF.VN,TDF.VN,Công ty Cổ phần Trung Đô,Xây dựng Trung Đô,
TDG.VN,TDG.VN,Công ty Cổ phần Đầu tư TDG Global,Đầu tư TDG Global,
TDH.VN,TDH.VN,Công ty Cổ phần Phát triển Nhà Thủ Đức,Thủ Đức House,
TDM.VN,TDM.VN,Công ty Cổ phần Nước Thủ Dầu Một,Nước Thủ Dầu Một,
TDP.VN,TDP.VN,Công ty Cổ phần Thuận Đức,Công ty Thuận Đức,
TDS.VN,TDS.VN,Công ty Cổ phần Thép Thủ Đức - VNSTEEL,Thép Thủ Đức,
TDT.VN,TDT.VN,Công ty Cổ phần Đầu tư và Phát triển TDT,Đầu tư và Phát triển TDT,
TDW.VN,TDW.VN,Công ty Cổ phần Cấp nước Thủ Đức,Cấp nước Thủ Đức,
TED.VN,TED.VN,Tổng Công ty Tư vấn Thiết kế Giao thông Vận tải - CTCP,Thiết kế GTVT,
TEG.VN,TEG.VN,Công ty Cổ phần Trường Thành Energy Group,Trường Thành Energy Group,
TET.VN,TET.VN,Công ty Cổ phần Vải sợi May mặc Miền Bắc,May mặc Miền Bắc,
TFC.VN,TFC.VN,Công ty Cổ phần Trang,CTCP Trang,
TGG.VN,TGG.VN,Công ty Cổ phần The Golden Group,The Golden Group,
TGP.VN,TGP.VN,Công ty Cổ phần Trường Phú,Cáp Trường Phú,
TH1.VN,TH1.VN,Công ty Cổ phần Xuất nhập khẩu Tổng hợp I Việt Nam,XNK Tổng hợp 1,
THB.VN,THB.VN,Công ty Cổ phần Bia Hà Nội - Thanh Hóa,Bia Hà Nội - Thanh Hóa,
THD.VN,THD.VN,Công ty Cổ phần Thaiholdings,Công ty Thaiholdings,
THG.VN,THG.VN,Công ty Cổ phần Đầu tư và Xây dựng Tiền Giang,XD Tiền Giang,
THM.VN,THM.VN,Công ty Cổ phần Tứ Hải Hà Nam,Tứ Hải Hà Nam,
THN.VN,THN.VN,Công ty Cổ phần Cấp nước Thanh Hóa,Cấp nước Thanh Hóa,
THP.VN,THP.VN,Công ty Cổ phần Thủy sản và Thương mại Thuận Phước,Thủy sản và TMại Thuận Phước,
THS.VN,THS.VN,Công ty Cổ phần Thanh Hoa Sông Đà,Thanh Hoa Sông Đà,
THT.VN,THT.VN,Công ty Cổ phần Than Hà Tu - Vinacomin,Than Hà Tu,
THU.VN,THU.VN,Công ty Cổ phần Môi trường và Công trình đô thị Thanh Hóa,Môi trường và CTĐT Thanh Hóa,
THW.VN,THW.VN,Công ty Cổ phần Cấp nước Tân Hòa,Cấp nước Tân Hòa,
TID.VN,TID.VN,Công ty Cổ phần Tổng Công ty Tín Nghĩa,Tổng Công ty Tín Nghĩa,
TIE.VN,TIE.VN,Công ty Cổ phần TIE,Điện tử TIE,
TIG.VN,TIG.VN,Công ty Cổ phần Tập đoàn Đầu tư Thăng Long,Tập đoàn Đầu tư Thăng Long,
TIN.VN,TIN.VN,Công ty Tài chính tổng hợp cổ phần Tín Việt,Tài chính Cổ phần Tín Việt,
TIP.VN,TIP.VN,Công ty Cổ phần Phát triển Khu công nghiệp Tín Nghĩa,PT KCN Tín Nghĩa,
TIS.VN,TIS.VN,Công ty Cổ phần Gang thép Thái Nguyên,Gang thép Thái Nguyên,
TIX.VN,TIX.VN,Công ty Cổ phần Sản xuất Kinh doanh Xuất nhập khẩu Dịch vụ và Đầu tư Tân Bình,TANIMEX,
TJC.VN,TJC.VN,Công ty Cổ phần Dịch vụ Vận tải và Thương mại,Dịch vụ Vận tải và Thương mại,
TKA.VN,TKA.VN,Công ty Cổ phần Bao bì Tân Khánh An,Bao bì Tân Khánh An,
TKU.VN,TKU.VN,Công ty Cổ phần Công nghiệp Tung Kuang,Công nghiệp Tung Kuang,
TL4.VN,TL4.VN,Tổng Công ty Xây dựng Thủy lợi 4 - Công ty Cổ phần,XD Thủy lợi 4,
TLD.VN,TLD.VN,Công ty Cổ phần Đầu tư Xây dựng và Phát triển Đô thị Thăng Long,ĐT XD và PT Đô thị Thăng Long,
TLG.VN,TLG.VN,Công ty Cổ phần Tập đoàn Thiên Long,Tập đoàn Thiên Long,
TLH.VN,TLH.VN,Công ty Cổ phần Tập đoàn Thép Tiến Lên,Thép Tiến Lên,
TLP.VN,TLP.VN,Tổng Công ty Thương mại Xuất nhập khẩu Thanh Lễ - CTCP,Thương mại XNK Thanh Lễ,
TMB.VN,TMB.VN,Công ty Cổ phần Kinh doanh Than Miền Bắc - Vinacomin,Than Miền Bắc - Vinacomin,
TMC.VN,TMC.VN,Công ty Cổ phần Thương mại Xuất nhập khẩu Thủ Đức,XNK Thủ Đức,
TMG.VN,TMG.VN,Công ty Cổ phần Kim loại màu Thái Nguyên - Vimico,Kim loại màu Thái Nguyên - Vimico,
TMP.VN,TMP.VN,Công ty Cổ phần Thủy điện Thác Mơ,Thủy điện Thác Mơ,
TMS.VN,TMS.VN,Công ty Cổ phần Transimex,Transimex,
TMT.VN,TMT.VN,Công ty Cổ phần Ô tô TMT,Ô tô TMT,
TMW.VN,TMW.VN,Công ty Cổ phần Tổng hợp Gỗ Tân Mai,Gỗ Tân Mai,
TMX.VN,TMX.VN,Công ty Cổ phần VICEM Thương mại Xi măng,Thương mại Xi măng,
TN1.VN,TN1.VN,Công ty Cổ phần Rox Key Holdings,Rox Key Holdings,
TNA.VN,TNA.VN,Công ty Cổ phần Thương mại Xuất nhập khẩu Thiên Nam,XNK Thiên Nam,
TNB.VN,TNB.VN,Công ty Cổ phần Thép Nhà Bè - VNSTEEL,Thép Nhà Bè,
TNC.VN,TNC.VN,Công ty Cổ phần Cao su Thống Nhất,Cao su Thống Nhất,
TNG.VN,TNG.VN,Công ty Cổ phần Đầu tư và Thương mại TNG,Đầu tư và Thương mại TNG,
TNH.VN,TNH.VN,Công ty Cổ phần Tập đoàn Bệnh viện TNH,Tập đoàn Bệnh viện TNH,
TNI.VN,TNI.VN,Công ty Cổ phần Tập đoàn Thành Nam,Tập đoàn Thành Nam,
TNP.VN,TNP.VN,Công ty Cổ phần Cảng Thị Nại,Cảng Thị Nại,
TNS.VN,TNS.VN,Công ty Cổ phần Thép tấm lá Thống Nhất,Thép tấm lá Thống Nhất,
TNT.VN,TNT.VN,Công ty Cổ phần Tập đoàn TNT,Tập đoàn TNT,
TNW.VN,TNW.VN,Công ty Cổ phần Nước sạch Thái Nguyên,Nước sạch Thái Nguyên,
TOP.VN,TOP.VN,Công ty Cổ phần Phân phối Top One,Phân phối Top One,
TOS.VN,TOS.VN,Công ty Cổ phần Dịch vụ biển Tân Cảng,Dịch vụ biển Tân Cảng,
TOT.VN,TOT.VN,Công ty Cổ phần Transimex Logistics,Vận tải Transimex,
TOW.VN,TOW.VN,Công ty Cổ phần Cấp nước Trà Nóc - Ô Môn,Cấp nước Trà Nóc - Ô Môn,
TPB.VN,TPB.VN,Ngân hàng Thương mại Cổ phần Tiên Phong,TPBank,TPBank
TPC.VN,TPC.VN,Công ty Cổ phần Nhựa Tân Đại Hưng,Nhựa Tân Đại Hưng,
TPP.VN,TPP.VN,Công ty Cổ phần Tân Phú Việt Nam,Nhựa Tân Phú VN,
TPS.VN,TPS.VN,Công ty Cổ phần Bến bãi vận tải Sài Gòn,Bến bãi vận tải Sài Gòn,
TQW.VN,TQW.VN,Công ty Cổ phần Cấp thoát nước Tuyên Quang,Cấp thoát nước Tuyên Quang,
TR1.VN,TR1.VN,Công ty Cổ phần Vận Tải 1 Traco,Vận Tải 1 Traco,
TRA.VN,TRA.VN,Công ty Cổ phần Traphaco,Traphaco,
TRC.VN,TRC.VN,Công ty Cổ phần Cao su Tây Ninh,Cao su Tây Ninh,
TRS.VN,TRS.VN,Công ty Cổ phần Vận tải và Dịch vụ Hàng Hải,Vận tải và Dịch vụ Hàng Hải,
TRT.VN,TRT.VN,Công ty Cổ phần RedstarCera,CTCP RedstarCera,
TRV.VN,TRV.VN,Công ty Cổ Phần Vận tải Đường sắt,Vận tải Đường sắt,
TS3.VN,TS3.VN,Công ty Cổ phần Trường Sơn 532,Trường Sơn 532,
TSA.VN,TSA.VN,Công ty Cổ Phần Đầu Tư Và Xây Lắp Trường Sơn,Đầu Tư Và Xây Lắp Trường Sơn,
TSB.VN,TSB.VN,Công ty Cổ phần Ắc quy Tia Sáng,Ắc quy Tia Sáng,
TSC.VN,TSC.VN,Công ty Cổ phần Vật tư Kỹ thuật Nông nghiệp Cần Thơ,Kỹ thuật NN Cần Thơ,
TSD.VN,TSD.VN,Công ty Cổ phần Du lịch Trường Sơn Coecco,Du lịch Trường Sơn Coecco,
TSG.VN,TSG.VN,Công ty Cổ phần Thông tin Tín hiệu Đường sắt Sài Gòn,TTTH Đường sắt Sài Gòn,
TSJ.VN,TSJ.VN,Công ty Cổ phần Du lịch Dịch vụ Hà Nội,Hanoi Toserco,
TST.VN,TST.VN,Công ty Cổ phần Dịch vụ Kỹ thuật Viễn thông,Dịch vụ KT Viễn Thông,
TT6.VN,TT6.VN,Công ty Cổ Phần Tập Đoàn Tiến Thịnh,Tien Thinh Group,
TTA.VN,TTA.VN,Công ty Cổ phần Đầu tư Xây dựng và Phát triển Trường Thành,XD và PT Trường Thành,
TTB.VN,TTB.VN,Công ty Cổ phần TTBGROUP,Tập đoàn Tiến Bộ,
TTC.VN,TTC.VN,Công ty Cổ phần Gạch men Thanh Thanh,Gạch men Thanh Thanh,
TTD.VN,TTD.VN,Công ty Cổ phần Bệnh viện Tim Tâm Đức,Bệnh viện Tim Tâm Đức,
TTE.VN,TTE.VN,Công ty Cổ phần Đầu tư Năng lượng Trường Thịnh,ĐT Năng lượng Trường Thịnh,
TTF.VN,TTF.VN,Công ty Cổ phần Tập đoàn Kỹ nghệ Gỗ Trường Thành,Gỗ Trường Thành,
TTG.VN,TTG.VN,Công ty Cổ phần May Thanh Trì,May Thanh Trì,
TTH.VN,TTH.VN,Công ty Cổ phần Thương mại và Dịch vụ Tiến Thành,TM và DV Tiến Thành,
TTL.VN,TTL.VN,Tổng Công ty Thăng Long - Công ty Cổ phần,TCT Thăng Long,
TTN.VN,TTN.VN,Công ty Cổ phần Công nghệ & Truyền thông Việt Nam,Công nghệ và Truyền thông VN,
TTS.VN,TTS.VN,Công ty Cổ phần Cán thép Thái Trung,Cán thép Thái Trung,
TTT.VN,TTT.VN,Công ty Cổ phần Du Lịch - Thương Mại Tây Ninh,Du lịch - Thương Mại Tây Ninh,
TTZ.VN,TTZ.VN,Công ty Cổ phần Đầu tư Xây dựng và Công nghệ Tiến Trung,Xây dựng Tiến Trung,
TUG.VN,TUG.VN,Công ty Cổ phần Lai dắt và Vận tải Cảng Hải Phòng,Lai dắt và VT cảng Hải Phòng,
TV1.VN,TV1.VN,Công ty Cổ phần Tư vấn Xây dựng Điện 1,Tư vấn XD Điện 1,
TV2.VN,TV2.VN,Công ty Cổ phần Tư vấn Xây dựng Điện 2,Tư vấn XD Điện 2,
TV3.VN,TV3.VN,Công ty Cổ phần Tư vấn Xây dựng Điện 3,Tư vấn XD điện 3,
TV4.VN,TV4.VN,Công ty Cổ phần Tư vấn Xây dựng Điện 4,Tư vấn XD Điện 4,
TV6.VN,TV6.VN,Công ty Cổ phần Tập đoàn EMA LAND,Tập đoàn EMA LAND,
TVA.VN,TVA.VN,Công ty cổ phần Sứ Viglacera Thanh Trì,Sứ Viglacera Thanh Trì,
TVB.VN,TVB.VN,Công ty Cổ phần Chứng khoán T-Cap,Chứng khoán T-Cap,
TVC.VN,TVC.VN,Công ty Cổ phần Tập đoàn Quản lý tài sản T-Corp,Tập đoàn Quản lý tài sản T-Corp,
TVD.VN,TVD.VN,Công ty Cổ phần Than Vàng Danh - Vinacomin,Than Vàng Danh,
TVG.VN,TVG.VN,Công ty Cổ phần Tư vấn Đầu tư và Xây dựng Giao thông Vận tải,XD Giao thông Vận tải,
TVH.VN,TVH.VN,Công ty Cổ phần Tư vấn Xây dựng công trình Hàng hải,Tư vấn XD công trình Hàng hải,
TVM.VN,TVM.VN,Công ty Cổ phần Tư vấn đầu tư Mỏ và công nghiệp - Vinacomin,Tư vấn đầu tư Mỏ,
TVN.VN,TVN.VN,Tổng Công ty Thép Việt Nam - Công ty Cổ phần,Thép Việt Nam,
TVS.VN,TVS.VN,Công ty Cổ phần Chứng khoán Thiên Việt,Chứng khoán Thiên Việt,
TVT.VN,TVT.VN,Tổng Công ty Việt Thắng - CTCP,May Việt Thắng,
TW3.VN,TW3.VN,Công ty Cổ phần Dược Trung Ương 3,Dược TW3,
TXM.VN,TXM.VN,Công ty Cổ phần VICEM Thạch cao Xi Măng,Thạch cao Xi măng,
TYA.VN,TYA.VN,Công ty Cổ phần Dây và Cáp điện Taya Việt Nam,Dây và Cáp điện Taya,
UCT.VN,UCT.VN,Công ty Cổ phần Đô thị Cần Thơ,Đô thị Cần Thơ,
UDC.VN,UDC.VN,Công ty Cổ phần Đầu tư Xây dựng UDCons,Đầu tư Xây dựng UDCons,
UDJ.VN,UDJ.VN,Công ty Cổ phần Phát triển Đô thị,Becamex UDJ,
UDL.VN,UDL.VN,Công ty Cổ phần Đô thị và Môi trường Đắk Lắk,Đô thị và Môi trường Đắk Lắk,
UEM.VN,UEM.VN,Công ty Cổ phần Cơ điện Uông Bí - Vinacomin,Cơ điện Uông Bí - Vinacomin,
UIC.VN,UIC.VN,Công ty Cổ phần Đầu tư Phát triển Nhà và Đô thị IDICO,Phát triển Nhà và Đô thị IDICO,
UMC.VN,UMC.VN,Công ty Cổ phần Công trình đô thị Nam Định,Công trình đô thị Nam Định,
UNI.VN,UNI.VN,Công ty Cổ phần Đầu tư và Phát triển Sao Mai Việt,Đầu tư và Phát triển Sao Mai Việt,
UPC.VN,UPC.VN,Công ty Cổ phần Phát triển Công viên Cây xanh và Đô thị Vũng Tàu,Cây xanh Vũng Tàu,
UPH.VN,UPH.VN,Công ty Cổ phần Dược phẩm TW25,Dược phẩm TW25,
UPS.VN,UPS.VN,Công ty Cổ phần Chứng khoán UP,Chứng khoán UP,
USC.VN,USC.VN,Công ty Cổ phần Khảo sát và Xây dựng - USCO,Khảo sát và Xây dựng - USCO,
USD.VN,USD.VN,Công ty Cổ phần Công trình Đô thị Sóc Trăng,Công trình Đô thị Sóc Trăng,
UTT.VN,UTT.VN,Công ty Cổ phần Môi trường Đô thị Thanh Trì,Môi trường Đô thị Thanh Trì,
UXC.VN,UXC.VN,Công ty Cổ phần Chế biến Thủy sản Út Xi,Chế biến Thủy sản Út Xi,
V12.VN,V12.VN,Công ty Cổ phần Xây dựng số 12,VINACONEX 12,
V21.VN,V21.VN,Công ty Cổ phần Vinaconex 21,Vinaconex 21,
VAB.VN,VAB.VN,Ngân hàng Thương mại Cổ phần Việt Á,Ngân hàng Việt Á,
VAF.VN,VAF.VN,Công ty Cổ phần Phân lân nung chảy Văn Điển,Phân lân Văn Điển,
VAV.VN,VAV.VN,Công ty Cổ phần VIWACO,VIWACO,
VBB.VN,VBB.VN,Ngân hàng Thương mại Cổ phần Việt Nam Thương Tín,VietBank,
VBC.VN,VBC.VN,"Công ty Cổ phần Nhựa, Bao bì Vinh",Nhựa - Bao bì Vinh,
VBG.VN,VBG.VN,Công ty Cổ phần Địa chất Việt Bắc - TKV,Địa chất Việt Bắc - TKV,
VBH.VN,VBH.VN,Công ty Cổ phần Điện tử Bình Hòa,Điện tử Bình Hòa,
VBT.VN,VBT.VN,Cổ phiếu Công ty cổ phần Vận tải Bảo Thắng,Cổ phiếu Công ty cổ phần Vận tải Bảo Thắng,
VC1.VN,VC1.VN,Công ty Cổ phần Xây dựng số 1,Xây dựng số 1,
VC2.VN,VC2.VN,Công ty Cổ phần Đầu tư và Xây dựng VINA2,Đầu tư và Xây dựng VINA2,
VC3.VN,VC3.VN,Công ty Cổ phần Tập đoàn Nam Mê Kông,Tập đoàn Nam Mê Kông,
VC6.VN,VC6.VN,Công ty cổ phần Xây dựng và Đầu tư Visicons,Visicons,
VC7.VN,VC7.VN,Công ty Cổ phần Tập đoàn BGI,BGI Group,
VC9.VN,VC9.VN,Công ty Cổ phần Xây dựng số 9 - VC9,Xây dựng số 9,
VCA.VN,VCA.VN,Công ty Cổ phần Thép VICASA,Thép VICASA,
VCB.VN,VCB.VN,Ngân hàng Thương mại Cổ phần Ngoại thương Việt Nam,Vietcombank,Vietcombank
VCC.VN,VCC.VN,Công ty Cổ phần Vinaconex 25,Vinaconex 25,
VCE.VN,VCE.VN,Công ty Cổ phần Xây lắp Môi trường,Xây lắp Môi trường,
VCF.VN,VCF.VN,Công ty Cổ phần VinaCafé Biên Hòa,VinaCafé Biên Hòa,
VCG.VN,VCG.VN,Tổng Công ty Cổ phần Xuất nhập khẩu và Xây dựng Việt Nam,VINACONEX,
VCI.VN,VCI.VN,Công ty Cổ phần Chứng khoán Vietcap,Chứng khoán Vietcap,
VCK.VN,VCK.VN,Công ty Cổ phần Chứng Khoán VPS,Chứng Khoán VPS,
VCM.VN,VCM.VN,Công ty Cổ phần BV Life,BV Life,
VCP.VN,VCP.VN,Công ty Cổ phần Xây dựng và Năng lượng VCP,Xây dựng và Năng lượng VCP,
VCR.VN,VCR.VN,Công ty Cổ phần Đầu tư và Phát triển Du lịch Vinaconex,Vinaconex - ITC,
VCS.VN,VCS.VN,Công ty Cổ phần VICOSTONE,VICOSTONE,
VCT.VN,VCT.VN,Công ty Cổ phần Tư vấn Xây dựng Vinaconex,Tư vấn XD Vinaconex,
VCX.VN,VCX.VN,Công ty Cổ phần Xi măng Yên Bình,Xi măng Yên Bình,
VDB.VN,VDB.VN,Công ty Cổ phần Vận tải và Chế biến Than Đông Bắc,Vận tải và CB Than Đông Bắc,
VDG.VN,VDG.VN,Công ty Cổ phần Vạn Đạt Group,Vạn Đạt Group,
VDL.VN,VDL.VN,Công ty Cổ phần Thực phẩm Lâm Đồng,Thực phẩm Lâm Đồng,
VDN.VN,VDN.VN,Công ty Cổ phần Vinatex Đà Nẵng,Vinatex Đà Nẵng,
VDP.VN,VDP.VN,Công ty Cổ phần Dược phẩm Trung ương VIDIPHA,Dược phẩm VIDIPHA,
VDS.VN,VDS.VN,Công ty Cổ phần Chứng khoán Rồng Việt,Chứng khoán Rồng Việt,
VDT.VN,VDT.VN,Công ty Cổ phần Lưới thép Bình Tây,Lưới thép Bình Tây,
VE1.VN,VE1.VN,Công ty Cổ phần Xây dựng điện VNECO 1,VNECO 1,
VE2.VN,VE2.VN,Công ty Cổ phần Xây dựng Điện VNECO 2,Xây dựng Điện VNECO 2,
VE3.VN,VE3.VN,Công ty Cổ phần Xây dựng điện VNECO 3,Xây dựng điện VNECO 3,
VE4.VN,VE4.VN,Công ty Cổ phần Xây dựng điện VNECO4,Xây dựng điện VNECO4,
VE8.VN,VE8.VN,Công ty Cổ phần Xây dựng Điện Vneco 8,Xây dựng Điện Vneco 8,
VE9.VN,VE9.VN,Công ty Cổ phần Đầu tư và Xây dựng VNECO 9,VNECO 9,
VEA.VN,VEA.VN,Tổng Công ty Máy động lực và Máy nông nghiệp Việt Nam - CTCP,Máy động lực và Máy NN,
VEC.VN,VEC.VN,Tổng Công ty Cổ phần Điện tử và Tin học Việt Nam,Điện tử và Tin học VN,
VEF.VN,VEF.VN,Công ty Cổ phần Trung tâm Hội chợ Triển lãm Việt Nam,Hội chợ Triển lãm Việt Nam,
VES.VN,VES.VN,Công ty Cổ phần Đầu tư và Xây dựng Điện MÊ CA VNECO,MÊ CA VNECO,
VET.VN,VET.VN,Công ty Cổ phần Thuốc Thú y Trung ương NAVETCO,Thuốc thú y trung ương Navetco,
VFC.VN,VFC.VN,Công ty Cổ phần VINAFCO,Vận tải biển VINAFCO,
VFG.VN,VFG.VN,Công ty Cổ phần Khử trùng Việt Nam,Khử trùng Việt Nam,
VFR.VN,VFR.VN,Công ty Cổ phần Vận tải và Thuê tàu,Vận tải Vietfracht,
VFS.VN,VFS.VN,Công ty Cổ phần Chứng khoán Nhất Việt,Chứng khoán Nhất Việt,
VGC.VN,VGC.VN,Tổng Công ty Viglacera - Công ty Cổ phần,Tổng Công ty Viglacera,
VGG.VN,VGG.VN,Tổng Công Ty Cổ phần May Việt Tiến,May Việt Tiến,
VGI.VN,VGI.VN,Tổng Công ty Cổ phần Đầu tư Quốc tế Viettel,Đầu tư Quốc tế Viettel,
VGL.VN,VGL.VN,Công ty Cổ phần Mạ kẽm công nghiệp Vingal-Vnsteel,Mạ kẽm công nghiệp Vingal-Vnsteel,
VGP.VN,VGP.VN,Công ty Cổ phần Cảng Rau Quả,Cảng Rau Quả,
VGR.VN,VGR.VN,Công ty Cổ phần Cảng xanh VIP,Cảng xanh VIP,
VGS.VN,VGS.VN,Công ty Cổ phần Ống thép Việt - Đức VG PIPE,Ống thép Việt Đức,
VGT.VN,VGT.VN,Tập đoàn Dệt May Việt Nam,VINATEX,
VGV.VN,VGV.VN,Tổng Công ty Tư vấn Xây dựng Việt Nam - CTCP,Tư vấn Xây dựng Việt Nam,
VHC.VN,VHC.VN,Công ty Cổ phần Vĩnh Hoàn,Thủy sản Vĩnh Hoàn,
VHD.VN,VHD.VN,Công ty Cổ phần Đầu tư phát triển nhà và đô thị VINAHUD,PT Nhà và Đô thị Vinaconex,
VHE.VN,VHE.VN,Công ty Cổ phần Dược liệu và Thực phẩm Việt Nam,Dược liệu và Thực phẩm VN,
VHF.VN,VHF.VN,Công ty Cổ phần Xây dựng và Chế biến lương thực Vĩnh Hà,Chế biến lương thực Vĩnh Hà,
VHG.VN,VHG.VN,Công ty Cổ phần Đầu tư và Phát triển Việt Trung Nam,Đầu tư và Phát triển Việt Trung Nam,
VHH.VN,VHH.VN,Công ty Cổ phần Đầu tư Kinh doanh nhà Thành Đạt,Kinh doanh nhà Thành Đạt,
VHL.VN,VHL.VN,Công ty Cổ phần Viglacera Hạ Long,Viglacera Hạ Long,
VHM.VN,VHM.VN,Công ty Cổ phần Vinhomes,Vinhomes,Vinhomes
VIB.VN,VIB.VN,Ngân hàng Thương mại Cổ phần Quốc tế Việt Nam,VIBBank,
VIC.VN,VIC.VN,Tập đoàn Vingroup - Công ty CP,VinGroup,Vingroup
VID.VN,VID.VN,Công ty Cổ phần Đầu tư Phát triển Thương mại Viễn Đông,Viễn Đông,
VIE.VN,VIE.VN,Công ty Cổ phần Công nghệ Viễn thông VI TE CO,CN Viễn thông VI TE CO,
VIF.VN,VIF.VN,Tổng Công ty Lâm nghiệp Việt Nam - Công ty Cổ phần,Lâm nghiệp Việt Nam,
VIG.VN,VIG.VN,Công ty Cổ phần Chứng khoán Đầu tư Tài chính Việt Nam,Chứng khoán Đầu tư Tài chính Việt Nam,
VIM.VN,VIM.VN,Công ty Cổ phần Khoáng sản Viglacera,Khoáng sản Viglacera,
VIN.VN,VIN.VN,Công ty Cổ phần Giao nhận Kho vận Ngoại thương Việt Nam,Kho vận ngoại thương VN,
VIP.VN,VIP.VN,Công ty Cổ phần Vận tải Xăng dầu VIPCO,Vận tải Xăng dầu VIPCO,
VIR.VN,VIR.VN,Công ty Cổ phần Du lịch Quốc tế Vũng Tàu,Du lịch Vũng Tàu,
VIT.VN,VIT.VN,Công ty Cổ phần Viglacera Tiên Sơn,Viglacera Tiên Sơn,
VIW.VN,VIW.VN,Tổng công ty Đầu tư Nước và Môi trường Việt Nam - Công ty Cổ phần,Đầu tư nước và môi trường VN - Viwaseen,
VIX.VN,VIX.VN,Công ty Cổ phần Chứng khoán VIX,Chứng khoán VIX,
VJC.VN,VJC.VN,Công ty Cổ phần Hàng không Vietjet,Vietjet Air,Vietjet
VKC.VN,VKC.VN,Công ty Cổ phần VKC Holdings,VKC Holdings,
VLA.VN,VLA.VN,Công ty Cổ phần Đầu tư và Phát triển Công nghệ Văn Lang,PT Công nghệ Văn Lang,
VLB.VN,VLB.VN,Công ty Cổ phần Xây dựng và Sản xuất Vật liệu Xây dựng Biên Hòa,VLXD Biên Hòa,
VLC.VN,VLC.VN,Tổng Công ty Chăn nuôi Việt Nam - Công ty Cổ phần,Chăn nuôi Việt Nam,
VLG.VN,VLG.VN,Công ty Cổ phần VIMC Logistics,VIMC Logistics,
VLP.VN,VLP.VN,Công ty Cổ phần Công trình Công cộng Vĩnh Long,Công trình Công cộng Vĩnh Long,
VLS.VN,VLS.VN,Công ty Cổ phần Sản xuất Thép Việt Long,Sản xuất Thép Việt Long,
